,actual,country,date,forecast,forecast_error,impact,new,previous,previous_error,time
0,,JPY,"Monday, February 26, 2018",,-,Low,JPY BOJ Outright Bond Purchase 5~10 Years,,-,01:10
1,107.4,JPY,"Monday, February 26, 2018",,-,Low,JPY Leading Index CI (DEC F),107.9,-,05:00
2,120.2,JPY,"Monday, February 26, 2018",,-,Low,JPY Coincident Index (DEC F),120.7,-,05:00
3,14.9b,CNY,"Monday, February 26, 2018",,-,Low,CNY FX Net Settlement - Clients CNY (JAN),44.5b,-,07:19
4,576.0b,CHF,"Monday, February 26, 2018",,-,Low,CHF Total Sight Deposits CHF (23 FEB),575.1b,-,09:00
5,460.2b,CHF,"Monday, February 26, 2018",,-,Low,CHF Domestic Sight Deposits CHF (23 FEB),462.0b,-,09:00
6,40117,GBP,"Monday, February 26, 2018",37000,u,Medium,GBP BBA Loans for House Purchase (JAN),36085,d,09:30
7,,EUR,"Monday, February 26, 2018",,-,Low,EUR ECB's Coeure speaks in Frankfurt,,-,10:00
8,,USD,"Monday, February 26, 2018",,-,Low,USD Fed's Bullard Speaks on U.S. Economy and Monetary Policy,,-,13:00
9,0.12,USD,"Monday, February 26, 2018",0.25,d,Low,USD Chicago Fed Nat Activity Index (JAN),0.14,d,13:30
10,,EUR,"Monday, February 26, 2018",,-,High,EUR ECB President Draghi speaks in Brussels,,-,14:40
11,593k,USD,"Monday, February 26, 2018",647k,d,Low,USD New Home Sales (JAN),643k,u,15:00
12,-7.8%,USD,"Monday, February 26, 2018",3.5%,d,Medium,USD New Home Sales (MoM) (JAN),-7.6%,u,15:00
13,37.2,USD,"Monday, February 26, 2018",30.0,u,Low,USD Dallas Fed Manufacturing Activity (FEB),33.4,-,15:30
14,,EUR,"Monday, February 26, 2018",,-,Low,EUR Luis de Guindos at hearing for ECB Vice President in Brussels,,-,16:15
15,,USD,"Monday, February 26, 2018",,-,Low,USD U.S. to Sell USD51 Bln 3-Month Bills,,-,16:30
16,,USD,"Monday, February 26, 2018",,-,Low,USD U.S. to Sell USD45 Bln 6-Month Bills,,-,16:30
17,,GBP,"Monday, February 26, 2018",,-,Low,GBP BOE's Cunliffe Speaks at Event at Warwick University,,-,18:00
18,,USD,"Monday, February 26, 2018",,-,Low,USD Fed's Quarles Gives Assessment of U.S. Economy,,-,20:15
19,-566m,NZD,"Monday, February 26, 2018",0m,d,Medium,NZD Trade Balance (JAN),596m,d,21:45
20,4.31b,NZD,"Monday, February 26, 2018",4.58b,d,Low,NZD Exports (JAN),5.49b,d,21:45
21,4.87b,NZD,"Monday, February 26, 2018",4.60b,u,Low,NZD Imports (JAN),4.89b,d,21:45
22,-3218m,NZD,"Monday, February 26, 2018",-2711m,d,Medium,NZD Trade Balance 12 Mth YTD (JAN),-2879m,d,21:45
23,117.9,AUD,"Monday, February 26, 2018",,-,Low,AUD ANZ Roy Morgan Weekly Consumer Confidence Index (25 FEB),115.3,-,22:30
24,,EUR,"Tuesday, February 27, 2018",,-,Low,EUR ECB's Mersch speaks in Brussels,,-,08:40
25,4.6%,EUR,"Tuesday, February 27, 2018",4.6%,-,Low,EUR Euro-Zone M3 Money Supply (YoY) (JAN),4.6%,-,09:00
26,,GBP,"Tuesday, February 27, 2018",,-,Low,GBP BOE's Sam Woods speaks in London,,-,09:00
27,114.1,EUR,"Tuesday, February 27, 2018",114.0,u,Low,EUR Euro-Zone Economic Confidence (FEB),114.9,u,10:00
28,1.48,EUR,"Tuesday, February 27, 2018",1.47,u,Low,EUR Euro-Zone Business Climate Indicator (FEB),1.56,u,10:00
29,8.0,EUR,"Tuesday, February 27, 2018",8.0,-,Low,EUR Euro-Zone Industrial Confidence (FEB),9.0,u,10:00
30,17.5,EUR,"Tuesday, February 27, 2018",16.3,u,Low,EUR Euro-Zone Services Confidence (FEB),16.8,u,10:00
31,0.1,EUR,"Tuesday, February 27, 2018",0.1,-,Low,EUR Euro-Zone Consumer Confidence (FEB F),0.1,-,10:00
32,,EUR,"Tuesday, February 27, 2018",,-,Low,EUR Bundesbank's Weidmann Presents Institution's Annual Report,,-,10:00
33,0.5%,EUR,"Tuesday, February 27, 2018",0.5%,-,Medium,EUR German Consumer Price Index (MoM) (FEB P),-0.7%,-,13:00
34,1.4%,EUR,"Tuesday, February 27, 2018",1.5%,d,High,EUR German Consumer Price Index (YoY) (FEB P),1.6%,-,13:00
35,,USD,"Tuesday, February 27, 2018",,-,High,USD Fed Powell's Congressional Testimony is Released,,-,13:30
36,-$74.4b,USD,"Tuesday, February 27, 2018",-$72.3b,d,High,USD Advance Goods Trade Balance (JAN),-$72.3b,d,13:30
37,0.7%,USD,"Tuesday, February 27, 2018",0.4%,u,Medium,USD Wholesale Inventories (MoM) (JAN P),0.6%,u,13:30
38,0.8%,USD,"Tuesday, February 27, 2018",,-,Low,USD Retail Inventories (MoM) (JAN),0.3%,u,13:30
39,-3.7%,USD,"Tuesday, February 27, 2018",-2.0%,d,High,USD Durable Goods Orders (JAN P),2.6%,d,13:30
40,-0.3%,USD,"Tuesday, February 27, 2018",0.4%,d,Medium,USD Durables Ex Transportation (JAN P),0.7%,-,13:30
41,-0.2%,USD,"Tuesday, February 27, 2018",0.5%,d,Low,USD Cap Goods Orders Nondef Ex Air (JAN P),-0.6%,-,13:30
42,0.1%,USD,"Tuesday, February 27, 2018",0.3%,d,Low,USD Cap Goods Ship Nondef Ex Air (JAN P),0.7%,u,13:30
43,1.6%,USD,"Tuesday, February 27, 2018",,-,Medium,USD House Price Purchase Index (QoQ) (4Q),1.5%,u,14:00
44,0.3%,USD,"Tuesday, February 27, 2018",0.4%,d,Medium,USD House Price Index (MoM) (DEC),0.5%,u,14:00
45,204.45,USD,"Tuesday, February 27, 2018",,-,Low,USD S&P/Case-Shiller 20-City Index n.s.a (DEC),204.11,d,14:00
46,0.64%,USD,"Tuesday, February 27, 2018",0.6%,u,Medium,USD S&P CoreLogic CS 20-City (MoM) SA (DEC),0.74%,d,14:00
47,6.3%,USD,"Tuesday, February 27, 2018",6.35%,d,Medium,USD S&P/Case-Shiller Composite-20 (YoY) (DEC),6.36%,d,14:00
48,196.23,USD,"Tuesday, February 27, 2018",,-,Low,USD S&P/Case-Shiller US Home Price Index (DEC),195.78,d,14:00
49,6.27%,USD,"Tuesday, February 27, 2018",,-,Medium,USD S&P/Case-Shiller US Home Price Index (YoY) (DEC),6.13%,d,14:00
50,28,USD,"Tuesday, February 27, 2018",15,u,Low,USD Richmond Fed Manufact. Index (FEB),14,-,15:00
51,130.8,USD,"Tuesday, February 27, 2018",126.5,u,High,USD Consumer Confidence Index (FEB),124.3,d,15:00
52,162.4,USD,"Tuesday, February 27, 2018",,-,Medium,USD Conf. Board Present Situation (FEB),154.7,d,15:00
53,109.7,USD,"Tuesday, February 27, 2018",,-,Low,USD Conf. Board Expectations (FEB),104,d,15:00
54,,USD,"Tuesday, February 27, 2018",,-,High,USD Fed's Powell Testifies to House Financial Services Committee,,-,15:00
55,,USD,"Tuesday, February 27, 2018",,-,Low,USD U.S. to Sell USD22 Bln 52-Week Bills,,-,16:30
56,,USD,"Tuesday, February 27, 2018",,-,Low,USD U.S. to Sell 4-Week Bills,,-,16:30
57,,CAD,"Tuesday, February 27, 2018",,-,Low,CAD Finance Minister Morneau Delivers Canada's Federal Budget,,-,21:00
58,6210,NZD,"Tuesday, February 27, 2018",,-,Low,NZD Net Migration s.a. (JAN),5780,u,21:45
59,-1.8%,JPY,"Tuesday, February 27, 2018",-0.6%,d,Low,JPY Retail Trade s.a. (MoM) (JAN),0.9%,-,23:50
60,1.6%,JPY,"Tuesday, February 27, 2018",2.4%,d,Medium,JPY Retail Trade (YoY) (JAN),3.6%,-,23:50
61,0.5%,JPY,"Tuesday, February 27, 2018",0.4%,u,Medium,JPY Large Retailers' Sales (JAN),1.1%,-,23:50
62,-6.6%,JPY,"Tuesday, February 27, 2018",-4.0%,d,Low,JPY Industrial Production (MoM) (JAN P),2.9%,-,23:50
63,2.7%,JPY,"Tuesday, February 27, 2018",5.3%,d,Medium,JPY Industrial Production (YoY) (JAN P),4.4%,-,23:50
64,20.4,NZD,"Wednesday, February 28, 2018",,-,Medium,NZD ANZ Activity Outlook (FEB),15.6,-,00:00
65,-19.0,NZD,"Wednesday, February 28, 2018",,-,Low,NZD ANZ Business Confidence (FEB),-37.8,-,00:00
66,-10,GBP,"Wednesday, February 28, 2018",-10,-,Medium,GBP GfK Consumer Confidence (FEB),-9,-,00:01
67,33,GBP,"Wednesday, February 28, 2018",,-,Low,GBP Lloyds Business Barometer (FEB),35,-,00:01
68,-0.8%,GBP,"Wednesday, February 28, 2018",-0.6%,d,Low,GBP BRC Shop Price Index (YoY) (FEB),-0.5%,-,00:01
69,0.3%,AUD,"Wednesday, February 28, 2018",0.4%,d,Low,AUD Private Sector Credit (MoM) (JAN),0.3%,-,00:30
70,4.9%,AUD,"Wednesday, February 28, 2018",5.0%,d,Medium,AUD Private Sector Credit (YoY) (JAN),4.9%,u,00:30
71,54.4,CNY,"Wednesday, February 28, 2018",55.0,d,Medium,CNY Non-manufacturing PMI (FEB),55.3,-,00:52
72,50.3,CNY,"Wednesday, February 28, 2018",51.1,d,High,CNY Manufacturing PMI (FEB),51.3,-,00:52
73,52.9,CNY,"Wednesday, February 28, 2018",,-,Medium,CNY Composite PMI (FEB),54.6,-,00:52
74,,JPY,"Wednesday, February 28, 2018",,-,Low,JPY BOJ Outright Bond Purchase 3~5 Years,,-,01:10
75,,JPY,"Wednesday, February 28, 2018",,-,Low,JPY BOJ Outright Bond Purchase 1~3 Years,,-,01:10
76,,JPY,"Wednesday, February 28, 2018",,-,Low,JPY BOJ Outright Bond Purchase 25 Years~,,-,01:10
77,,JPY,"Wednesday, February 28, 2018",,-,Low,JPY BOJ Outright Bond Purchase 10~25 Years,,-,01:10
78,-3.8%,JPY,"Wednesday, February 28, 2018",,-,Low,JPY Vehicle Production (YoY) (JAN),2.1%,u,04:00
79,-13.2%,JPY,"Wednesday, February 28, 2018",-4.7%,d,Medium,JPY Housing Starts (YoY) (JAN),-2.1%,-,05:00
80,0.856m,JPY,"Wednesday, February 28, 2018",0.940m,d,Low,JPY Annualized Housing Starts (JAN),0.936m,-,05:00
81,0.9%,JPY,"Wednesday, February 28, 2018",,-,Medium,JPY Construction Orders (YoY) (JAN),-8.1%,-,05:00
82,10.8,EUR,"Wednesday, February 28, 2018",10.9,d,Medium,EUR German GfK Consumer Confidence (MAR),11.0,-,07:00
83,0.6%,EUR,"Wednesday, February 28, 2018",0.6%,-,Low,EUR French Gross Domestic Product (QoQ) (4Q P),0.6%,-,07:45
84,2.5%,EUR,"Wednesday, February 28, 2018",2.4%,u,Medium,EUR French Gross Domestic Product (YoY) (4Q P),2.4%,-,07:45
85,108.0,CHF,"Wednesday, February 28, 2018",106.0,u,Medium,CHF KOF Leading Indicator (FEB),107.6,u,08:00
86,-22k,EUR,"Wednesday, February 28, 2018",-15k,u,High,EUR German Unemployment Change (000's) (FEB),-25k,-,08:55
87,5.4%,EUR,"Wednesday, February 28, 2018",5.4%,-,High,EUR German Unemployment Claims Rate s.a. (FEB),5.4%,-,08:55
88,25.8,CHF,"Wednesday, February 28, 2018",,-,Low,CHF Credit Suisse Survey Expectations (FEB),34.5,-,09:00
89,1.0%,EUR,"Wednesday, February 28, 2018",1.0%,-,High,EUR Euro-Zone Consumer Price Index Core (YoY) (FEB A),1.0%,-,10:00
90,1.2%,EUR,"Wednesday, February 28, 2018",1.2%,-,High,EUR Euro-Zone Consumer Price Index Estimate (YoY) (FEB),1.3%,-,10:00
91,2.7%,USD,"Wednesday, February 28, 2018",,-,Medium,USD MBA Mortgage Applications (23 FEB),-6.6%,-,12:00
92,3.6%,USD,"Wednesday, February 28, 2018",3.8%,d,Medium,USD Personal Consumption (4Q S),3.8%,-,13:30
93,0.3%,CAD,"Wednesday, February 28, 2018",0.5%,d,Low,CAD Industrial Product Price (MoM) (JAN),-0.1%,-,13:30
94,3.3%,CAD,"Wednesday, February 28, 2018",,-,Low,CAD Raw Materials Price Index (MoM) (JAN),-0.9%,-,13:30
95,2.5%,USD,"Wednesday, February 28, 2018",2.5%,-,High,USD Gross Domestic Product Annualized (QoQ) (4Q S),2.6%,-,13:30
96,2.3%,USD,"Wednesday, February 28, 2018",2.4%,d,High,USD Gross Domestic Product Price Index (4Q S),2.4%,-,13:30
97,1.9%,USD,"Wednesday, February 28, 2018",1.9%,-,Medium,USD Core PCE (QoQ) (4Q S),1.9%,-,13:30
98,61.9,USD,"Wednesday, February 28, 2018",64.1,d,Medium,USD Chicago Purchasing Manager (FEB),65.7,-,14:45
99,-4.7%,USD,"Wednesday, February 28, 2018",0.5%,d,Low,USD Pending Home Sales (MoM) (JAN),0.0%,d,15:00
100,-1.7%,USD,"Wednesday, February 28, 2018",,-,Medium,USD Pending Home Sales (YoY) (JAN),-1.8%,-,15:00
101,,USD,"Wednesday, February 28, 2018",,-,Low,USD Revisions: Pending Home Sales,,-,15:00
102,3019k,USD,"Wednesday, February 28, 2018",3000k,d,Medium,USD DOE U.S. Crude Oil Inventories (23 FEB),-1616k,-,15:30
103,-1218k,USD,"Wednesday, February 28, 2018",,-,Low,USD DOE Cushing OK Crude Inventory (23 FEB),-2664k,-,15:30
104,2483k,USD,"Wednesday, February 28, 2018",600k,d,Low,USD DOE U.S. Gasoline Inventories (23 FEB),261k,-,15:30
105,-960k,USD,"Wednesday, February 28, 2018",-950k,u,Low,USD DOE U.S. Distillate Inventory (23 FEB),-2422k,-,15:30
106,-1.2%,NZD,"Wednesday, February 28, 2018",,-,Low,NZD ANZ Job Advertisements (MoM) (FEB),2.9%,d,21:00
107,57.5,AUD,"Wednesday, February 28, 2018",,-,Medium,AUD AiG Performance of Manufacturing Index (FEB),58.7,-,21:30
108,0.8%,NZD,"Wednesday, February 28, 2018",0.5%,u,Medium,NZD Terms of Trade Index (QoQ) (4Q),0.7%,-,21:45
109,55.6,AUD,"Wednesday, February 28, 2018",,-,Low,AUD CBA Australia PMI Mfg (FEB),55.4,-,22:00
110,-0.3%,AUD,"Wednesday, February 28, 2018",,-,Low,AUD CoreLogic House Px (MoM) (FEB),-0.5%,-,23:00
111,¥201.3b,JPY,"Wednesday, February 28, 2018",,-,Low,JPY Japan Buying Foreign Bonds (Yen) (23 FEB),-¥512.6b,u,23:50
112,¥45.0b,JPY,"Wednesday, February 28, 2018",,-,Low,JPY Japan Buying Foreign Stocks (Yen) (23 FEB),-¥587.1b,-,23:50
113,-¥20.6b,JPY,"Wednesday, February 28, 2018",,-,Low,JPY Foreign Buying Japan Bonds (23 FEB),-¥789.5b,-,23:50
114,-¥53.6b,JPY,"Wednesday, February 28, 2018",,-,Low,JPY Foreign Buying Japan Stocks (23 FEB),¥127.2b,u,23:50
115,4.3%,JPY,"Wednesday, February 28, 2018",3.0%,u,Low,JPY Capital Spending (4Q),4.2%,-,23:50
116,4.7%,JPY,"Wednesday, February 28, 2018",2.7%,u,Low,JPY Capital Spending excl Software (4Q),4.3%,-,23:50
117,0.9%,JPY,"Wednesday, February 28, 2018",,-,Low,JPY Company Profits (4Q),5.5%,-,23:50
118,5.9%,JPY,"Wednesday, February 28, 2018",,-,Low,JPY Company Sales (4Q),4.8%,-,23:50
119,2.53%,JPY,"Wednesday, February 28, 2018",,-,Medium,JPY Loans & Discounts Corp (YoY) (JAN),2.77%,-,23:50
120,-0.2%,AUD,"Thursday, March 1, 2018",1.0%,d,Medium,AUD Private Capital Expenditure (4Q),1.9%,u,00:30
121,54.1,JPY,"Thursday, March 1, 2018",,-,Low,JPY Nikkei Japan PMI Manufacturing (FEB F),54,-,00:30
122,,JPY,"Thursday, March 1, 2018",,-,Low,JPY BOJ Kataoka makes a speech,,-,01:30
123,51.6,CNY,"Thursday, March 1, 2018",51.3,u,Medium,CNY Caixin China PMI Mfg (FEB),51.5,-,01:45
124,44.3,JPY,"Thursday, March 1, 2018",44.8,d,Medium,JPY Consumer Confidence Index (FEB),44.7,-,05:00
125,-4.9%,JPY,"Thursday, March 1, 2018",,-,Low,JPY Vehicle Sales (YoY) (FEB),-5.7%,-,05:00
126,-1.0%,AUD,"Thursday, March 1, 2018",,-,Low,AUD RBA Commodity Index SDR (YoY) (FEB),-1.1%,d,05:30
127,139.8,AUD,"Thursday, March 1, 2018",,-,Low,AUD Commodity Index AUD (FEB),134.6,d,05:30
128,0.6%,CHF,"Thursday, March 1, 2018",0.5%,u,Medium,CHF Gross Domestic Product (QoQ) (4Q),0.7%,u,06:45
129,1.9%,CHF,"Thursday, March 1, 2018",1.7%,-,High,CHF Gross Domestic Product (YoY) (4Q),1.2%,-,06:45
130,-0.3%,GBP,"Thursday, March 1, 2018",0.1%,d,Low,GBP Nationwide House PX (MoM) (FEB),0.8%,u,07:00
131,2.2%,GBP,"Thursday, March 1, 2018",2.6%,d,Medium,GBP Nationwide House Px n.s.a. (YoY) (FEB),3.2%,-,07:00
132,-1.4%,CHF,"Thursday, March 1, 2018",,-,Medium,CHF Retail Sales Real (YoY) (JAN),0.7%,u,08:15
133,65.5,CHF,"Thursday, March 1, 2018",64.1,u,Medium,CHF PMI Manufacturing (FEB),65.3,-,08:30
134,56.8,EUR,"Thursday, March 1, 2018",58,d,Low,EUR Markit/ADACI Italy Manufacturing PMI (FEB),59,-,08:45
135,55.9,EUR,"Thursday, March 1, 2018",56.1,d,Low,EUR Markit France Manufacturing PMI (FEB F),56.1,-,08:50
136,60.6,EUR,"Thursday, March 1, 2018",60.3,u,Low,EUR Markit/BME Germany Manufacturing PMI (FEB F),60.3,-,08:55
137,58.6,EUR,"Thursday, March 1, 2018",58.5,u,Low,EUR Markit Eurozone Manufacturing PMI (FEB F),58.5,-,09:00
138,1.3b,GBP,"Thursday, March 1, 2018",1.4b,d,Medium,GBP Net Consumer Credit (JAN),1.6b,u,09:30
139,3.4b,GBP,"Thursday, March 1, 2018",3.6b,d,Medium,GBP Net Lending Sec. on Dwellings (JAN),3.5b,d,09:30
140,67.5k,GBP,"Thursday, March 1, 2018",62.0k,u,Medium,GBP Mortgage Approvals (JAN),61.7k,u,09:30
141,1.5%,GBP,"Thursday, March 1, 2018",,-,Low,GBP Money Supply M4 (MoM) (JAN),-0.6%,-,09:30
142,4.3%,GBP,"Thursday, March 1, 2018",,-,Low,GBP M4 Money Supply (YoY) (JAN),3.8%,u,09:30
143,5.1%,GBP,"Thursday, March 1, 2018",,-,Low,GBP M4 Ex IOFCs 3M Annualised (JAN),4.8%,u,09:30
144,55.2,GBP,"Thursday, March 1, 2018",55.0,u,Medium,GBP Markit UK PMI Manufacturing s.a. (FEB),55.3,-,09:30
145,8.6%,EUR,"Thursday, March 1, 2018",8.6%,-,Medium,EUR Euro-Zone Unemployment Rate (JAN),8.6%,u,10:00
146,1.5%,EUR,"Thursday, March 1, 2018",1.5%,-,Medium,EUR Italian Annual Gross Domestic Product (YoY) (2017),0.9%,-,10:00
147,-$16.35b,CAD,"Thursday, March 1, 2018",-$17.65b,u,Low,CAD Current Account Balance (4Q),-$18.59b,-,13:30
148,0.4%,USD,"Thursday, March 1, 2018",0.3%,u,Medium,USD Personal Income (JAN),0.4%,-,13:30
149,0.2%,USD,"Thursday, March 1, 2018",0.2%,-,Medium,USD Personal Spending (JAN),0.4%,-,13:30
150,-0.1%,USD,"Thursday, March 1, 2018",-0.1%,-,Medium,USD Real Personal Spending (JAN),0.2%,d,13:30
151,0.4%,USD,"Thursday, March 1, 2018",0.4%,-,Low,USD PCE Deflator (MoM) (JAN),0.1%,-,13:30
152,1.7%,USD,"Thursday, March 1, 2018",1.7%,-,Low,USD PCE Deflator (YoY) (JAN),1.7%,-,13:30
153,0.3%,USD,"Thursday, March 1, 2018",0.3%,-,Medium,USD PCE Core (MoM) (JAN),0.2%,-,13:30
154,1.5%,USD,"Thursday, March 1, 2018",1.5%,-,High,USD PCE Core (YoY) (JAN),1.5%,-,13:30
155,210k,USD,"Thursday, March 1, 2018",225k,u,Medium,USD Initial Jobless Claims (24 FEB),220k,u,13:30
156,1931k,USD,"Thursday, March 1, 2018",1925k,d,Medium,USD Continuing Claims (17 FEB),1874k,u,13:30
157,55.6,CAD,"Thursday, March 1, 2018",,-,High,CAD RBC Canadian Manufacturing PMI (FEB),55.9,-,14:30
158,55.3,USD,"Thursday, March 1, 2018",55.9,d,Low,USD Markit US Manufacturing PMI (FEB F),55.9,-,14:45
159,0.0%,USD,"Thursday, March 1, 2018",0.3%,d,Medium,USD Construction Spending (MoM) (JAN),0.8%,u,15:00
160,60.8,USD,"Thursday, March 1, 2018",58.7,u,High,USD ISM Manufacturing (FEB),59.1,-,15:00
161,59.7,USD,"Thursday, March 1, 2018",,-,High,USD ISM Employment (FEB),54.2,-,15:00
162,74.2,USD,"Thursday, March 1, 2018",70.0,u,Medium,USD ISM Prices Paid (FEB),72.7,-,15:00
163,64.2,USD,"Thursday, March 1, 2018",,-,Low,USD ISM New Orders (FEB),65.4,-,15:00
164,-78,USD,"Thursday, March 1, 2018",-77,u,Low,USD EIA Working Natural Gas Implied Flow (23 FEB),-124,-,15:30
165,-78,USD,"Thursday, March 1, 2018",-77,u,Low,USD EIA Natural Gas Storage Change (23 FEB),-124,-,15:30
166,12.94m,USD,"Thursday, March 1, 2018",13.30m,d,Low,USD Domestic Vehicle Sales (FEB),13.10m,-,19:40
167,16.96m,USD,"Thursday, March 1, 2018",17.20m,d,Low,USD Wards Total Vehicle Sales (FEB),17.07m,-,19:40
168,127.7,NZD,"Thursday, March 1, 2018",,-,Low,NZD ANZ Consumer Confidence Index (FEB),126.9,-,21:00
169,0.6%,NZD,"Thursday, March 1, 2018",,-,Low,NZD ANZ Consumer Confidence (MoM) (FEB),4.2%,-,21:00
170,0.2%,NZD,"Thursday, March 1, 2018",,-,Medium,NZD Building Permits (MoM) (JAN),-9.5%,u,21:45
171,1.59,JPY,"Thursday, March 1, 2018",1.60,d,Low,JPY Job-To-Applicant Ratio (JAN),1.59,-,23:30
172,2.4%,JPY,"Thursday, March 1, 2018",2.8%,u,Medium,JPY Jobless Rate (JAN),2.7%,u,23:30
173,1.4%,JPY,"Thursday, March 1, 2018",1.4%,-,Low,JPY Tokyo Consumer Price Index (YoY) (FEB),1.3%,-,23:30
174,0.9%,JPY,"Thursday, March 1, 2018",0.8%,u,Low,JPY Tokyo Consumer Price Index Ex-Fresh Food (YoY) (FEB),0.7%,-,23:30
175,0.5%,JPY,"Thursday, March 1, 2018",0.5%,-,Low,"JPY Tokyo CPI Ex-Fresh Food, Energy (YoY) (FEB)",0.4%,-,23:30
176,9.4%,JPY,"Thursday, March 1, 2018",,-,Medium,JPY Monetary Base (YoY) (FEB),9.7%,-,23:50
177,¥475.2t,JPY,"Thursday, March 1, 2018",¥476.6t,d,Medium,JPY Monetary Base End of period (FEB),¥476.7t,-,23:50
178,-0.7%,EUR,"Friday, March 2, 2018",0.7%,d,Low,EUR German Retail Sales (MoM) (JAN),-1.1%,u,07:00
179,2.3%,EUR,"Friday, March 2, 2018",3.0%,d,Medium,EUR German Retail Sales (YoY) (JAN),-0.2%,u,07:00
180,0.5%,EUR,"Friday, March 2, 2018",0.4%,u,Low,EUR German Import Price Index (MoM) (JAN),0.3%,-,07:00
181,0.7%,EUR,"Friday, March 2, 2018",0.7%,-,Low,EUR German Import Price Index (YoY) (JAN),1.1%,-,07:00
182,,EUR,"Friday, March 2, 2018",,-,Low,EUR ECB's Mersch speaks in Prague,,-,08:10
183,0.3%,EUR,"Friday, March 2, 2018",0.3%,-,Low,EUR Italian Gross Domestic Product w.d.a. (QoQ) (4Q F),0.3%,-,09:00
184,1.6%,EUR,"Friday, March 2, 2018",1.6%,-,Medium,EUR Italian Gross Domestic Product w.d.a. (YoY) (4Q F),1.6%,-,09:00
185,51.4,GBP,"Friday, March 2, 2018",50.5,u,Medium,GBP Markit/CIPS UK Construction PMI (FEB),50.2,-,09:30
186,,GBP,"Friday, March 2, 2018",,-,High,GBP Carney Speaks on Money at Event in London,,-,10:00
187,0.4%,EUR,"Friday, March 2, 2018",0.4%,-,Low,EUR Euro-Zone Producer Price Index (MoM) (JAN),0.1%,d,10:00
188,1.5%,EUR,"Friday, March 2, 2018",1.6%,d,Low,EUR Euro-Zone Producer Price Index (YoY) (JAN),2.2%,-,10:00
189,0.1%,CAD,"Friday, March 2, 2018",0.1%,-,Medium,CAD Gross Domestic Product (MoM) (DEC),0.4%,-,13:30
190,3.3%,CAD,"Friday, March 2, 2018",3.3%,-,High,CAD Gross Domestic Product (YoY) (DEC),3.5%,-,13:30
191,1.7%,CAD,"Friday, March 2, 2018",2.0%,d,High,CAD Quarterly Gross Domestic Product Annualized (4Q),1.5%,d,13:30
192,,GBP,"Friday, March 2, 2018",,d,High,GBP UK PM Theresa May Speaks on Britain and EU Post-Brexit,,d,13:30
193,99.7,USD,"Friday, March 2, 2018",99.5,u,Medium,USD U. of Mich. Sentiment (FEB F),99.9,-,15:00
194,114.9,USD,"Friday, March 2, 2018",,-,Low,USD U. of Mich. Current Conditions (FEB F),115.1,-,15:00
195,90.0,USD,"Friday, March 2, 2018",,-,Low,USD U. of Mich. Expectations (FEB F),90.2,-,15:00
196,2.7%,USD,"Friday, March 2, 2018",,-,Low,USD U. of Mich. 1 Yr Inflation (FEB F),2.7%,-,15:00
197,2.5%,USD,"Friday, March 2, 2018",,-,Medium,USD U. of Mich. 5-10 Yr Inflation (FEB F),2.5%,-,15:00
198,981,USD,"Friday, March 2, 2018",,-,Medium,USD Baker Hughes U.S. Rig Count (2 MAR),978,-,18:00
199,,AUD,"Tuesday, February 20, 2018",,-,Medium,AUD RBA February Meeting Minutes,,-,00:30
200,48.8%,JPY,"Tuesday, February 20, 2018",,-,Low,JPY Machine Tool Orders (YoY) (JAN F),48.8%,-,06:00
201,0.1%,JPY,"Tuesday, February 20, 2018",,-,Low,JPY Convenience Store Sales (YoY) (JAN),-0.3%,-,07:00
202,2.1%,EUR,"Tuesday, February 20, 2018",1.8%,u,Low,EUR German Producer Price Index (YoY) (JAN),2.3%,-,07:00
203,0.5%,EUR,"Tuesday, February 20, 2018",0.3%,u,Low,EUR German Producer Price Index (MoM) (JAN),0.2%,-,07:00
204,-5.1%,CHF,"Tuesday, February 20, 2018",,-,Low,CHF Exports (MoM) (JAN),3.3%,u,07:00
205,3.8%,CHF,"Tuesday, February 20, 2018",,-,Low,CHF Imports (MoM) (JAN),1%,u,07:00
206,12.6%,CHF,"Tuesday, February 20, 2018",,-,Low,CHF Swiss Watch Exports (YoY) (JAN),0.7%,-,07:00
207,92.3,EUR,"Tuesday, February 20, 2018",94.0,d,Medium,EUR German ZEW Survey Current Situation (FEB),95.2,-,10:00
208,17.8,EUR,"Tuesday, February 20, 2018",16.0,u,High,EUR German ZEW Survey Expectations (FEB),20.4,-,10:00
209,29.3,EUR,"Tuesday, February 20, 2018",,-,High,EUR Euro-Zone ZEW Survey (Economic Sentiment) (FEB),31.8,-,10:00
210,10,GBP,"Tuesday, February 20, 2018",11,d,Low,GBP CBI Trends Total Orders (FEB),14,-,11:00
211,25,GBP,"Tuesday, February 20, 2018",,-,Low,GBP CBI Trends Selling Prices (FEB),40,-,11:00
212,-0.5%,CAD,"Tuesday, February 20, 2018",0.4%,d,Low,CAD Wholesale Trade Sales (MoM) (DEC),0.3%,d,13:30
213,"$3,623",NZD,"Tuesday, February 20, 2018",,-,Medium,NZD Dairy Auction Avg. Winning Price MT (20 FEB),"$3,553",-,13:44
214,"$3,246",NZD,"Tuesday, February 20, 2018",,-,Medium,NZD Dairy Auction Whole Milk Powder MT (20 FEB),"$3,226",-,13:44
215,0.1,EUR,"Tuesday, February 20, 2018",1.0,d,Medium,EUR Euro-Zone Consumer Confidence (FEB A),1.4,u,15:00
216,,USD,"Tuesday, February 20, 2018",,-,Low,USD U.S. to Sell USD51 Bln 3-Month Bills,,-,16:30
217,,USD,"Tuesday, February 20, 2018",,-,Low,USD U.S. to Sell USD45 Bln 6-Month Bills,,-,16:30
218,,USD,"Tuesday, February 20, 2018",,-,Low,USD U.S. to Sell USD55 Bln 4-Week Bills,,-,18:00
219,,USD,"Tuesday, February 20, 2018",,-,Low,USD U.S. to Sell USD28 Bln 2-Year Notes,,-,18:00
220,-0.24%,AUD,"Tuesday, February 20, 2018",,-,Medium,AUD Westpac Leading Index (MoM) (JAN),0.21%,d,23:30
221,1.2%,AUD,"Wednesday, February 21, 2018",,-,Low,AUD Skilled Vacancies (MoM) (JAN),1.2%,u,00:00
222,0.6%,AUD,"Wednesday, February 21, 2018",0.5%,u,Low,AUD Wage Price Index (QoQ) (4Q),0.5%,-,00:30
223,2.1%,AUD,"Wednesday, February 21, 2018",2.0%,u,Medium,AUD Wage Price Index (YoY) (4Q),2.0%,-,00:30
224,-19.4%,AUD,"Wednesday, February 21, 2018",-10.0%,d,Low,AUD Construction Work Done (4Q),16.6%,u,00:30
225,54.0,JPY,"Wednesday, February 21, 2018",,-,Medium,JPY Nikkei Japan PMI Manufacturing (FEB P),54.8,-,00:30
226,,JPY,"Wednesday, February 21, 2018",,-,Low,JPY BOJ Outright Bond Purchase 3~5 Years,,-,01:10
227,,JPY,"Wednesday, February 21, 2018",,-,Low,JPY BOJ Outright Bond Purchase 1~3 Years,,-,01:10
228,,JPY,"Wednesday, February 21, 2018",,-,Low,JPY BOJ Outright Bond Purchase 5~10 Year,,-,01:10
229,,JPY,"Wednesday, February 21, 2018",,-,Low,JPY BOJ Funo speaks for 100 years anniversary of Matsue Branch,,-,01:10
230,-1.2%,JPY,"Wednesday, February 21, 2018",,-,Low,JPY Nationwide Department Store Sales (YoY) (JAN),-0.6%,-,04:24
231,-0.2%,JPY,"Wednesday, February 21, 2018",,-,Low,JPY Tokyo Department Store Sales (YoY) (JAN),0.9%,-,04:24
232,0.5%,JPY,"Wednesday, February 21, 2018",0.4%,u,Medium,JPY All Industry Activity Index (MoM) (DEC),1.0%,-,04:30
233,0.6%,JPY,"Wednesday, February 21, 2018",,-,Low,JPY Supermarket Sales (YoY) (JAN),0.9%,-,05:00
234,56.1,EUR,"Wednesday, February 21, 2018",58.0,d,Low,EUR Markit France Manufacturing PMI (FEB P),58.4,-,08:00
235,4.1%,CHF,"Wednesday, February 21, 2018",,-,Low,CHF Money Supply M3 (YoY) (JAN),3.6%,-,08:00
236,57.9,EUR,"Wednesday, February 21, 2018",59.0,d,Low,EUR Markit France Services PMI (FEB P),59.2,-,08:00
237,57.8,EUR,"Wednesday, February 21, 2018",59.2,d,Low,EUR Markit France Composite PMI (FEB P),59.6,-,08:00
238,60.3,EUR,"Wednesday, February 21, 2018",60.5,d,Medium,EUR Markit/BME Germany Manufacturing PMI (FEB P),61.1,-,08:30
239,55.3,EUR,"Wednesday, February 21, 2018",57.0,d,Medium,EUR Markit Germany Services PMI (FEB P),57.3,-,08:30
240,57.4,EUR,"Wednesday, February 21, 2018",58.5,d,Medium,EUR Markit/BME Germany Composite PMI (FEB P),59,-,08:30
241,58.5,EUR,"Wednesday, February 21, 2018",59.2,d,Medium,EUR Markit Eurozone Manufacturing PMI (FEB P),59.6,-,09:00
242,56.7,EUR,"Wednesday, February 21, 2018",57.6,d,Medium,EUR Markit Eurozone Services PMI (FEB P),58,-,09:00
243,57.5,EUR,"Wednesday, February 21, 2018",58.4,d,Medium,EUR Markit Eurozone Composite PMI (FEB P),58.8,-,09:00
244,2.3%,GBP,"Wednesday, February 21, 2018",,-,Medium,GBP Claimant Count Rate (JAN),2.4%,-,09:30
245,-7.2k,GBP,"Wednesday, February 21, 2018",,-,Medium,GBP Jobless Claims Change (JAN),6.2k,u,09:30
246,2.5%,GBP,"Wednesday, February 21, 2018",2.5%,-,Medium,GBP Average Weekly Earnings (3M/YoY) (DEC),2.5%,-,09:30
247,2.5%,GBP,"Wednesday, February 21, 2018",2.4%,u,Medium,GBP Weekly Earnings ex Bonus (3M/YoY) (DEC),2.3%,d,09:30
248,4.4%,GBP,"Wednesday, February 21, 2018",4.3%,d,Medium,GBP ILO Unemployment Rate 3Mths (DEC),4.3%,-,09:30
249,88k,GBP,"Wednesday, February 21, 2018",180k,d,Low,GBP Employment Change 3M/3M (DEC),102k,-,09:30
