,actual,country,date,forecast,forecast_error,impact,new,previous,previous_error,time
991,,USD,"Thursday, January 25, 2018",,-,Low,USD U.S. to Sell USD28 Bln 7-Year Notes,,-,18:00
992,1.0%,JPY,"Thursday, January 25, 2018",1.1%,d,High,JPY National Consumer Price Index (YoY) (DEC),0.6%,-,23:30
993,0.9%,JPY,"Thursday, January 25, 2018",0.9%,-,Medium,JPY National Consumer Price Index Ex-Fresh Food (YoY) (DEC),0.9%,-,23:30
994,0.3%,JPY,"Thursday, January 25, 2018",0.4%,d,Medium,"JPY Natl CPI Ex Fresh Food, Energy (YoY) (DEC)",0.3%,-,23:30
995,1.3%,JPY,"Thursday, January 25, 2018",1.1%,u,Low,JPY Tokyo Consumer Price Index (YoY) (JAN),1.0%,-,23:30
996,0.7%,JPY,"Thursday, January 25, 2018",0.8%,d,Low,JPY Tokyo Consumer Price Index Ex-Fresh Food (YoY) (JAN),0.8%,-,23:30
997,0.4%,JPY,"Thursday, January 25, 2018",0.4%,-,Low,"JPY Tokyo CPI Ex-Fresh Food, Energy (YoY) (JAN)",0.4%,-,23:30
998,0.8%,JPY,"Thursday, January 25, 2018",0.8%,-,Low,JPY Corporate Service Price (YoY) (DEC),0.8%,-,23:50
999,,JPY,"Thursday, January 25, 2018",,-,Medium,JPY BOJ Minutes of Policy Meeting,,-,23:50
1000,1.54%,CNY,"Friday, January 26, 2018",,-,Low,CNY Swift Global Payments CNY (DEC),1.75%,-,01:00
1001,,JPY,"Friday, January 26, 2018",,-,Low,JPY BOJ Outright Bond Purchase 1~3 Years,,-,01:10
1002,,JPY,"Friday, January 26, 2018",,-,Low,JPY BOJ Outright Bond Purchase 3~5 Years,,-,01:10
1003,,JPY,"Friday, January 26, 2018",,-,Low,JPY BOJ Outright Bond Purchase 10~25 Years,,-,01:10
1004,,JPY,"Friday, January 26, 2018",,-,Low,JPY BOJ Outright Bond Purchase 25 Years~,,-,01:10
1005,10.8%,CNY,"Friday, January 26, 2018",,-,Low,CNY Industrial Profits (YoY) (DEC),14.9%,-,01:30
1006,4.6%,EUR,"Friday, January 26, 2018",4.9%,d,Low,EUR Euro-Zone M3 Money Supply (YoY) (DEC),4.9%,-,09:00
1007,,EUR,"Friday, January 26, 2018",,-,Medium,EUR ECB Survey of Professional Forecasters,,-,09:00
1008,0.4%,GBP,"Friday, January 26, 2018",0.2%,u,Low,GBP Index of Services (MoM) (NOV),0.2%,-,09:30
1009,0.4%,GBP,"Friday, January 26, 2018",0.4%,-,Low,GBP Index of Services (3Mo3M) (NOV),0.3%,-,09:30
1010,0.5%,GBP,"Friday, January 26, 2018",0.4%,u,Medium,GBP Gross Domestic Product (QoQ) (4Q A),0.4%,-,09:30
1011,1.5%,GBP,"Friday, January 26, 2018",1.4%,u,High,GBP Gross Domestic Product (YoY) (4Q A),1.7%,-,09:30
1012,,EUR,"Friday, January 26, 2018",,-,Low,EUR ECB's Coeure speaks in Davos,,-,10:00
1013,,USD,"Friday, January 26, 2018",,-,Low,USD Fed's Bullard Speaks at Economics Workshop in Oslo,,-,13:00
1014,-0.4%,CAD,"Friday, January 26, 2018",-0.3%,d,Medium,CAD Consumer Price Index n.s.a. (MoM) (DEC),0.3%,-,13:30
1015,1.9%,CAD,"Friday, January 26, 2018",1.9%,-,High,CAD Consumer Price Index (YoY) (DEC),2.1%,-,13:30
1016,-$71.6b,USD,"Friday, January 26, 2018",-$68.9b,d,High,USD Advance Goods Trade Balance (DEC),-$70.0b,d,13:30
1017,1.9%,CAD,"Friday, January 26, 2018",,-,Low,CAD CPI Core- Trim (YoY) (DEC),1.8%,-,13:30
1018,0.2%,USD,"Friday, January 26, 2018",0.4%,d,Medium,USD Wholesale Inventories (MoM) (DEC P),0.7%,d,13:30
1019,1.6%,CAD,"Friday, January 26, 2018",,-,Low,CAD Consumer Price Index Core (YoY) (DEC),1.5%,-,13:30
1020,0.2%,USD,"Friday, January 26, 2018",,-,Low,USD Retail Inventories (MoM) (DEC),0.1%,-,13:30
1021,1.9%,CAD,"Friday, January 26, 2018",,-,Low,CAD CPI Core- Median (YoY) (DEC),1.9%,-,13:30
1022,130.8,CAD,"Friday, January 26, 2018",,-,Low,CAD Consumer Price Index (DEC),131.3,-,13:30
1023,2.6%,USD,"Friday, January 26, 2018",3.0%,d,High,USD Gross Domestic Product Annualized (QoQ) (4Q A),3.2%,-,13:30
1024,3.8%,USD,"Friday, January 26, 2018",3.7%,u,Medium,USD Personal Consumption (4Q),2.2%,-,13:30
1025,2.4%,USD,"Friday, January 26, 2018",2.3%,u,Medium,USD Gross Domestic Product Price Index (4Q A),2.1%,-,13:30
1026,1.9%,USD,"Friday, January 26, 2018",1.9%,-,Medium,USD Core PCE (QoQ) (4Q A),1.3%,-,13:30
1027,2.9%,USD,"Friday, January 26, 2018",0.8%,u,High,USD Durable Goods Orders (DEC P),1.7%,u,13:30
1028,0.6%,USD,"Friday, January 26, 2018",0.6%,-,Medium,USD Durables Ex Transportation (DEC P),0.3%,u,13:30
1029,-0.3%,USD,"Friday, January 26, 2018",0.5%,d,Low,USD Cap Goods Orders Nondef Ex Air (DEC P),0.2%,u,13:30
1030,0.6%,USD,"Friday, January 26, 2018",0.4%,u,Low,USD Cap Goods Ship Nondef Ex Air (DEC P),0.4%,u,13:30
1031,,GBP,"Friday, January 26, 2018",,-,High,GBP BOE Governor Mark Carney speaks on panel at Davos,,-,14:00
1032,947,USD,"Friday, January 26, 2018",934,d,Medium,USD Baker Hughes U.S. Rig Count (JAN 26),936,-,18:00
1033,,EUR,"Saturday, January 27, 2018",,-,Low,EUR German Retail Sales (MoM) (DEC),2.3%,-,
1034,,EUR,"Saturday, January 27, 2018",,-,Medium,EUR German Retail Sales (YoY) (DEC),4.4%,-,
1035,4.5%,AUD,"Tuesday, January 16, 2018",,-,Low,AUD New Motor Vehicle Sales (MoM) (DEC),0.2%,u,00:30
1036,6.7%,AUD,"Tuesday, January 16, 2018",,-,Low,AUD New Motor Vehicle Sales (YoY) (DEC),2.2%,u,00:30
1037,61.1%,NZD,"Tuesday, January 16, 2018",,-,Low,NZD Non Resident Bond Holdings (DEC),60.4%,-,02:00
1038,1.1%,JPY,"Tuesday, January 16, 2018",0.3%,u,Medium,JPY Tertiary Industry Index (MoM) (NOV),0.2%,d,04:30
1039,-1.97%,JPY,"Tuesday, January 16, 2018",,-,Medium,JPY Bankruptcies (YoY) (DEC),-2.3%,-,04:30
1040,-0.3%,EUR,"Tuesday, January 16, 2018",,d,Low,EUR German Wholesale Price Index (MoM) (DEC),0.5%,-,07:00
1041,1.8%,EUR,"Tuesday, January 16, 2018",,-,Low,EUR German Wholesale Price Index (YoY) (DEC),3.3%,-,07:00
1042,0.6%,EUR,"Tuesday, January 16, 2018",0.6%,-,Low,EUR German Consumer Price Index (MoM) (DEC F),0.6%,-,07:00
1043,1.7%,EUR,"Tuesday, January 16, 2018",1.7%,-,Medium,EUR German Consumer Price Index (YoY) (DEC F),1.7%,-,07:00
1044,-9.2%,CNY,"Tuesday, January 16, 2018",,-,Low,CNY Foreign Direct Investment (YoY) (DEC),90.7%,-,07:16
1045,,GBP,"Tuesday, January 16, 2018",,-,Low,"GBP Woods, Boss and Yallop testify on PRA before U.K. lawmakers.",,-,09:15
1046,2.7%,GBP,"Tuesday, January 16, 2018",2.8%,d,Medium,GBP CPIH (YoY) (DEC),2.8%,-,09:30
1047,0.4%,GBP,"Tuesday, January 16, 2018",0.4%,-,Medium,GBP Consumer Price Index (MoM) (DEC),0.3%,-,09:30
1048,3.0%,GBP,"Tuesday, January 16, 2018",3.0%,-,High,GBP Consumer Price Index (YoY) (DEC),3.1%,-,09:30
1049,2.5%,GBP,"Tuesday, January 16, 2018",2.6%,d,High,GBP Core Consumer Price Index (YoY) (DEC),2.7%,-,09:30
1050,278.1,GBP,"Tuesday, January 16, 2018",277.6,u,Low,GBP Retail Price Index (DEC),275.8,-,09:30
1051,0.8%,GBP,"Tuesday, January 16, 2018",0.6%,u,Low,GBP Retail Price Index (MoM) (DEC),0.2%,-,09:30
1052,4.1%,GBP,"Tuesday, January 16, 2018",3.9%,u,Low,GBP Retail Price Index (YoY) (DEC),3.9%,-,09:30
1053,4.2%,GBP,"Tuesday, January 16, 2018",3.9%,u,Low,GBP Retail Price Index Ex Mort Int.Payments (YoY) (DEC),4.0%,-,09:30
1054,0.1%,GBP,"Tuesday, January 16, 2018",0.4%,d,Low,GBP Producer Price Index Input n.s.a. (MoM) (DEC),1.6%,d,09:30
1055,4.9%,GBP,"Tuesday, January 16, 2018",5.3%,d,Low,GBP Producer Price Index Input n.s.a. (YoY) (DEC),7.3%,-,09:30
1056,0.4%,GBP,"Tuesday, January 16, 2018",0.2%,u,Low,GBP Producer Price Index Output n.s.a. (MoM) (DEC),0.4%,u,09:30
1057,3.3%,GBP,"Tuesday, January 16, 2018",2.9%,u,Low,GBP Producer Price Index Output n.s.a. (YoY) (DEC),3.1%,u,09:30
1058,0.3%,GBP,"Tuesday, January 16, 2018",0.2%,u,Low,GBP Producer Price Index Output Core n.s.a. (MoM) (DEC),0.2%,-,09:30
1059,2.5%,GBP,"Tuesday, January 16, 2018",2.3%,u,Low,GBP Producer Price Index Output Core n.s.a. (YoY) (DEC),2.3%,u,09:30
1060,5.1%,GBP,"Tuesday, January 16, 2018",4.2%,u,Medium,GBP House Price Index (YoY) (NOV),5.4%,u,09:30
1061,17.7,USD,"Tuesday, January 16, 2018",19,d,Low,USD Empire Manufacturing (JAN),19.6,u,13:30
1062,468.8,CHF,"Tuesday, January 16, 2018",,-,Medium,CHF Real Estate Index Family Homes (4Q),464.5,-,13:42
1063,$3310,NZD,"Tuesday, January 16, 2018",,-,Medium,NZD Dairy Auction Avg. Winning Price MT (JAN 16),$3124,-,15:00
1064,$3010,NZD,"Tuesday, January 16, 2018",,-,Medium,NZD Dairy Auction Whole Milk Powder MT (JAN 16),$2886,-,15:00
1065,,USD,"Tuesday, January 16, 2018",,-,Low,USD U.S. to Sell USD45 Bln 4-Week Bills,,-,16:30
1066,,USD,"Tuesday, January 16, 2018",,-,Low,USD U.S. to Sell USD48 Bln 3-Month Bills,,-,16:30
1067,,USD,"Tuesday, January 16, 2018",,-,Low,USD U.S. to Sell USD42 Bln 6-Month Bills,,-,16:30
1068,,CHF,"Tuesday, January 16, 2018",,-,High,CHF SNB President Jordan Speaks in Zurich,,-,17:00
1069,-4.2%,NZD,"Tuesday, January 16, 2018",,-,Low,NZD ANZ Truckometer Heavy (MoM) (DEC),2.9%,u,21:00
1070,105.1,AUD,"Tuesday, January 16, 2018",,-,Low,AUD Westpac Consumer Conf Index (JAN),103.3,-,23:30
1071,1.8%,AUD,"Tuesday, January 16, 2018",,-,Medium,AUD Westpac Consumer Confidence (JAN),3.6%,-,23:30
1072,5.7%,JPY,"Tuesday, January 16, 2018",-1.4%,u,Low,JPY Machine Orders (MoM) (NOV),5.0%,-,23:50
1073,4.1%,JPY,"Tuesday, January 16, 2018",-1.0%,u,Medium,JPY Machine Orders (YoY) (NOV),2.3%,-,23:50
1074,-2.2%,NZD,"Wednesday, January 17, 2018",,-,Low,NZD ANZ Commodity Price (DEC),-0.9%,-,00:00
1075,2.1%,AUD,"Wednesday, January 17, 2018",0.0%,u,Medium,AUD Home Loans (MoM) (NOV),-0.6%,-,00:30
1076,1.5%,AUD,"Wednesday, January 17, 2018",,-,Low,AUD Investment Lending (NOV),1.6%,-,00:30
1077,2.7%,AUD,"Wednesday, January 17, 2018",,-,Low,AUD Value of Loans (MoM) (NOV),0.0%,-,00:30
1078,,JPY,"Wednesday, January 17, 2018",,-,Low,JPY BOJ Outright Bond Purchase 1~3 Years,,-,01:10
1079,,JPY,"Wednesday, January 17, 2018",,-,Low,JPY BOJ Outright Bond Purchase 3~5 Years,,-,01:10
1080,-4.9%,EUR,"Wednesday, January 17, 2018",,-,Low,EUR EU 25 New Car Registrations (DEC),5.9%,-,07:00
1081,0.5%,EUR,"Wednesday, January 17, 2018",,-,Low,EUR Euro-Zone Construction Output s.a. (MoM) (NOV),-0.3%,u,10:00
1082,2.7%,EUR,"Wednesday, January 17, 2018",,-,Low,EUR Euro-Zone Construction Output w.d.a. (YoY) (NOV),2.2%,u,10:00
1083,0.9%,EUR,"Wednesday, January 17, 2018",0.9%,-,Medium,EUR Euro-Zone Consumer Price Index Core (YoY) (DEC F),0.9%,-,10:00
1084,1.4%,EUR,"Wednesday, January 17, 2018",1.4%,-,Medium,EUR Euro-Zone Consumer Price Index (YoY) (DEC F),1.5%,-,10:00
1085,0.4%,EUR,"Wednesday, January 17, 2018",0.4%,-,Medium,EUR Euro-Zone Consumer Price Index (MoM) (DEC),0.1%,-,10:00
1086,,GBP,"Wednesday, January 17, 2018",,-,Low,GBP BOE's Saunders Speaks at Event in London,,-,11:45
1087,4.1%,USD,"Wednesday, January 17, 2018",,-,Medium,USD MBA Mortgage Applications (JAN 12),8.3%,-,12:00
1088,0.9%,USD,"Wednesday, January 17, 2018",0.5%,u,Medium,USD Industrial Production (MoM) (DEC),-0.1%,d,14:15
1089,77.9%,USD,"Wednesday, January 17, 2018",77.4%,u,Low,USD Capacity Utilization (DEC),77.2%,u,14:15
1090,0.1%,USD,"Wednesday, January 17, 2018",0.3%,d,Medium,USD Manufacturing (SIC) Production (DEC),0.3%,u,14:15
1091,1.25%,CAD,"Wednesday, January 17, 2018",1.25%,-,High,CAD Bank of Canada Rate Decision (JAN 17),1.00%,-,15:00
1092,72,USD,"Wednesday, January 17, 2018",72,-,Medium,USD NAHB Housing Market Index (JAN),74,-,15:00
1093,,USD,"Wednesday, January 17, 2018",,-,Medium,USD U.S. Federal Reserve Releases Beige Book,,-,19:00
1094,,USD,"Wednesday, January 17, 2018",,-,Low,USD Fed's Evans Speaks on Economy and Monetary Policy,,-,20:00
1095,-10.1%,NZD,"Wednesday, January 17, 2018",,-,Low,NZD REINZ House Sales (YoY) (DEC),-8.9%,-,20:00
1096,$33.8b,USD,"Wednesday, January 17, 2018",,-,Low,USD Total Net TIC Flows (NOV),$152.9b,-,21:00
1097,$57.5B,USD,"Wednesday, January 17, 2018",,-,Medium,USD Net Long-term TIC Flows (NOV),$26.2b,u,21:00
1098,,USD,"Wednesday, January 17, 2018",,-,Low,USD Fed's Mester Discusses Monetary Policy Communication,,-,21:30
1099,¥953.5b,JPY,"Wednesday, January 17, 2018",,-,Low,JPY Japan Buying Foreign Bonds (Yen) (JAN 12),¥186.6b,u,23:50
1100,¥89.2b,JPY,"Wednesday, January 17, 2018",,-,Low,JPY Japan Buying Foreign Stocks (Yen) (JAN 12),¥217.0b,d,23:50
1101,¥86.8b,JPY,"Wednesday, January 17, 2018",,-,Low,JPY Foreign Buying Japan Bonds (JAN 12),-¥127.3b,u,23:50
1102,¥498.7b,JPY,"Wednesday, January 17, 2018",,-,Low,JPY Foreign Buying Japan Stocks (JAN 12),¥598.7b,u,23:50
1103,3.7%,AUD,"Thursday, January 18, 2018",,-,Medium,AUD Consumer Inflation Expectation (JAN),3.7%,-,00:00
1104,8.0%,GBP,"Thursday, January 18, 2018",-1.0%,u,Medium,GBP RICS House Price Balance (DEC),0.0%,-,00:01
1105,34.7k,AUD,"Thursday, January 18, 2018",15.0k,u,High,AUD Employment Change (DEC),63.6k,u,00:30
1106,5.5%,AUD,"Thursday, January 18, 2018",5.4%,d,High,AUD Unemployment Rate (DEC),5.4%,-,00:30
1107,15.1k,AUD,"Thursday, January 18, 2018",,-,Medium,AUD Full Time Employment Change (DEC),43.6k,u,00:30
1108,19.5k,AUD,"Thursday, January 18, 2018",,-,Low,AUD Part Time Employment Change (DEC),20.0k,u,00:30
1109,65.7%,AUD,"Thursday, January 18, 2018",65.5%,u,Low,AUD Participation Rate (DEC),65.5%,-,00:30
1110,A$1279m,AUD,"Thursday, January 18, 2018",,-,Low,AUD RBA Foreign Exchange Transaction (Australian dollar) (DEC),A$343m,-,00:30
1111,-A$1358m,AUD,"Thursday, January 18, 2018",,-,Low,AUD RBA FX Transactions Government (DEC),-A$457m,-,00:30
1112,A$2319m,AUD,"Thursday, January 18, 2018",,-,Low,AUD RBA FX Transactions Other (DEC),-A$664m,d,00:30
1113,,CNY,"Thursday, January 18, 2018",,-,Low,CNY China December Property Prices,,-,01:30
1114,44.5b,CNY,"Thursday, January 18, 2018",,-,Low,CNY China FX Net Settlement - Clients CNY (DEC),-31.2b,-,02:00
1115,0.5%,JPY,"Thursday, January 18, 2018",,-,Low,JPY Industrial Production (MoM) (NOV F),0.6%,-,04:30
1116,3.6%,JPY,"Thursday, January 18, 2018",,-,Low,JPY Industrial Production (YoY) (NOV F),3.7%,-,04:30
1117,0.0%,JPY,"Thursday, January 18, 2018",,-,Low,JPY Capacity Utilization (MoM) (NOV),0.2%,-,04:30
1118,6.8%,CNY,"Thursday, January 18, 2018",6.7%,u,High,CNY Gross Domestic Product (YoY) (4Q),6.8%,-,07:00
1119,1.6%,CNY,"Thursday, January 18, 2018",1.7%,d,High,CNY Gross Domestic Product s.a. (QoQ) (4Q),1.8%,u,07:00
1120,6.9%,CNY,"Thursday, January 18, 2018",6.8%,u,High,CNY Gross Domestic Product YTD (YoY) (4Q),6.9%,-,07:00
1121,10.2%,CNY,"Thursday, January 18, 2018",10.3%,d,Medium,CNY Retail Sales (YoY) (DEC),10.2%,-,07:00
1122,10.2%,CNY,"Thursday, January 18, 2018",10.3%,d,Medium,CNY Retail Sales YTD (YoY) (DEC),10.3%,-,07:00
1123,6.2%,CNY,"Thursday, January 18, 2018",6.1%,u,Medium,CNY Industrial Production (YoY) (DEC),6.1%,-,07:00
1124,6.6%,CNY,"Thursday, January 18, 2018",6.6%,-,Medium,CNY Industrial Production YTD (YoY) (DEC),6.6%,-,07:00
1125,7.2%,CNY,"Thursday, January 18, 2018",7.1%,u,Medium,CNY Fixed Assets Ex Rural YTD (YoY) (DEC),7.2%,-,07:00
1126,,EUR,"Thursday, January 18, 2018",,-,Low,"EUR ECB's Weidmann, Coeure, IMF's Lagarde speak in Frankfurt",,-,08:15
1127,,CAD,"Thursday, January 18, 2018",,-,Low,CAD ADP Canada Employment Report Published,,-,13:30
1128,1192k,USD,"Thursday, January 18, 2018",1275k,d,Low,USD Housing Starts (DEC),1299k,u,13:30
1129,-8.2%,USD,"Thursday, January 18, 2018",-1.7%,d,Medium,USD Housing Starts (MoM) (DEC),3.0%,d,13:30
1130,1302k,USD,"Thursday, January 18, 2018",1295k,u,Low,USD Building Permits (DEC),1303k,u,13:30
1131,-0.1%,USD,"Thursday, January 18, 2018",-0.6%,u,Medium,USD Building Permits (MoM) (DEC),-1.0%,u,13:30
1132,22.2,USD,"Thursday, January 18, 2018",25,d,Medium,USD Philadelphia Fed Business Outlook (JAN),27.9,u,13:30
1133,220k,USD,"Thursday, January 18, 2018",249k,u,Medium,USD Initial Jobless Claims (JAN 13),261k,-,13:30
1134,1952k,USD,"Thursday, January 18, 2018",1900k,d,Medium,USD Continuing Claims (JAN 06),1876k,d,13:30
1135,,EUR,"Thursday, January 18, 2018",,-,Low,EUR ECB's Coeure speaks on a panel in Frankfurt,,-,14:30
1136,-183,USD,"Thursday, January 18, 2018",-199,d,Low,USD EIA Working Natural Gas Implied Flow (JAN 12),-359,-,15:30
1137,-183,USD,"Thursday, January 18, 2018",-199,d,Low,USD EIA Natural Gas Storage Change (JAN 12),-359,-,15:30
1138,3620k,USD,"Thursday, January 18, 2018",3992k,u,Low,USD DOE U.S. Gasoline Inventories (JAN 12),4135k,-,16:00
1139,-6861k,USD,"Thursday, January 18, 2018",-3150k,u,Medium,USD DOE U.S. Crude Oil Inventories (JAN 12),-4948k,-,16:00
1140,-4184k,USD,"Thursday, January 18, 2018",,-,Low,USD DOE Cushing OK Crude Inventory (JAN 12),-2395k,-,16:00
1141,-3887k,USD,"Thursday, January 18, 2018",1550k,u,Low,USD DOE U.S. Distillate Inventory (JAN 12),4254k,-,16:00
1142,,USD,"Thursday, January 18, 2018",,-,Low,USD U.S. to Sell USD13 Bln 10-Year TIPS,,-,18:00
1143,51.2,NZD,"Thursday, January 18, 2018",,-,Medium,NZD BusinessNZ Manufacturing PMI (DEC),57.7,-,21:30
1144,,JPY,"Friday, January 19, 2018",,-,Low,JPY BOJ Outright Bond Purchase 5~10 Years,,-,01:10
1145,,JPY,"Friday, January 19, 2018",,-,Low,JPY BOJ Outright Bond Purchase 10~25 Years,,-,01:10
1146,,JPY,"Friday, January 19, 2018",,-,Low,JPY BOJ Outright Bond Purchase 25 Years~,,-,01:10
1147,0.2%,EUR,"Friday, January 19, 2018",0.2%,-,Low,EUR German Producer Price Index (MoM) (DEC),0.1%,-,07:00
1148,2.3%,EUR,"Friday, January 19, 2018",2.3%,-,Low,EUR German Producer Price Index (YoY) (DEC),2.5%,-,07:00
1149,0.2%,CHF,"Friday, January 19, 2018",,-,Low,CHF Producer & Import Prices (MoM) (DEC),0.6%,-,08:15
1150,1.8%,CHF,"Friday, January 19, 2018",,-,Low,CHF Producer & Import Prices (YoY) (DEC),1.8%,-,08:15
1151,32.5b,EUR,"Friday, January 19, 2018",,-,Low,EUR Euro-Zone Current Account s.a. (euros) (NOV),30.3b,d,09:00
1152,37.8b,EUR,"Friday, January 19, 2018",,-,Low,EUR Euro-Zone Current Account n.s.a. (euros) (NOV),35.4b,d,09:00
1153,-1.6%,GBP,"Friday, January 19, 2018",-1.0%,d,Low,GBP Retail Sales Ex Auto Fuel (MoM) (DEC),1.1%,d,09:30
1154,1.3%,GBP,"Friday, January 19, 2018",2.6%,d,Medium,GBP Retail Sales Ex Auto Fuel (YoY) (DEC),1.5%,-,09:30
1155,-1.5%,GBP,"Friday, January 19, 2018",-0.9%,d,Low,GBP Retail Sales Inc Auto Fuel (MoM) (DEC),1.0%,d,09:30
1156,1.4%,GBP,"Friday, January 19, 2018",2.6%,d,Low,GBP Retail Sales Inc Auto Fuel (YoY) (DEC),1.5%,d,09:30
1157,3.4%,CAD,"Friday, January 19, 2018",2.0%,u,Low,CAD Manufacturing Sales (MoM) (NOV),-0.6%,d,13:30
1158,19.56b,CAD,"Friday, January 19, 2018",,-,Low,CAD International Securities Transactions (Canadian dollar) (NOV),20.77b,d,13:30
1159,94.4,USD,"Friday, January 19, 2018",97.0,d,High,USD U. of Mich. Sentiment (JAN P),95.9,-,15:00
1160,84.8,USD,"Friday, January 19, 2018",85.3,d,Low,USD U. of Mich. Expectations (JAN P),84.3,-,15:00
1161,2.8%,USD,"Friday, January 19, 2018",,-,Low,USD U. of Mich. 1 Yr Inflation (JAN P),2.7%,-,15:00
1162,2.5%,USD,"Friday, January 19, 2018",,-,Low,USD U. of Mich. 5-10 Yr Inflation (JAN P),2.4%,-,15:00
1163,109.2,USD,"Friday, January 19, 2018",114.4,d,Low,USD U. of Mich. Current Conditions (JAN P),113.8,-,15:00
1164,936,USD,"Friday, January 19, 2018",,-,Medium,USD Baker Hughes U.S. Rig Count (JAN 19),939,-,18:00
1165,,USD,"Friday, January 19, 2018",,-,Low,USD Fed's Quarles Speaks on Bank Regulation,,-,18:00
1166,A$85.4b,AUD,"Monday, January 8, 2018",,-,Low,AUD Foreign Reserves (Australian dollar) (DEC),A$80.7b,d,05:30
1167,-0.4%,EUR,"Monday, January 8, 2018",0.0%,d,Low,EUR German Factory Orders (MoM) (NOV),0.7%,u,07:00
1168,8.7%,EUR,"Monday, January 8, 2018",7.8%,u,Medium,EUR German Factory Orders n.s.a. (YoY) (NOV),7.2%,u,07:00
1169,0.0%,CHF,"Monday, January 8, 2018",-0.1%,u,Low,CHF Consumer Price Index (MoM) (DEC),-0.1%,d,08:15
1170,0.8%,CHF,"Monday, January 8, 2018",0.8%,-,Medium,CHF Consumer Price Index (YoY) (DEC),0.8%,-,08:15
1171,0.2%,CHF,"Monday, January 8, 2018",,-,Low,CHF CPI EU Harmonized (MoM) (DEC),-0.3%,-,08:15
1172,1.1%,CHF,"Monday, January 8, 2018",,-,Medium,CHF CPI EU Harmonized (YoY) (DEC),0.8%,-,08:15
1173,-0.6%,GBP,"Monday, January 8, 2018",0.2%,d,Low,GBP Halifax House Prices (MoM) (DEC),0.3%,d,08:30
1174,2.7%,GBP,"Monday, January 8, 2018",3.3%,d,Low,GBP Halifax House Price 3Mths/Year (DEC),3.9%,-,08:30
1175,572.8,CHF,"Monday, January 8, 2018",,-,Low,CHF Total Sight Deposits CHF (JAN 05),573.2b,-,09:00
1176,471.4b,CHF,"Monday, January 8, 2018",,-,Low,CHF Domestic Sight Deposits CHF (JAN 05),473.4b,-,09:00
1177,32.9,EUR,"Monday, January 8, 2018",31.3,u,Low,EUR Euro-Zone Sentix Investor Confidence (JAN),31.1,-,09:30
1178,0.5,EUR,"Monday, January 8, 2018",0.5,-,Low,EUR Euro-Zone Consumer Confidence (DEC F),0.5,-,10:00
1179,1.5%,EUR,"Monday, January 8, 2018",1.3%,u,Low,EUR Euro-Zone Retail Sales (MoM) (NOV),-1.1%,-,10:00
1180,2.8%,EUR,"Monday, January 8, 2018",2.4%,u,Medium,EUR Euro-Zone Retail Sales (YoY) (NOV),0.2%,d,10:00
1181,116.0,EUR,"Monday, January 8, 2018",114.8,u,Low,EUR Euro-Zone Economic Confidence (DEC),114.6,-,10:00
1182,1.66,EUR,"Monday, January 8, 2018",1.5,u,Low,EUR Euro-Zone Business Climate Indicator (DEC),1.49,-,10:00
1183,9.1,EUR,"Monday, January 8, 2018",8.4,u,Low,EUR Euro-Zone Industrial Confidence (DEC),8.1,d,10:00
1184,18.4,EUR,"Monday, January 8, 2018",16.5,u,Low,EUR Euro-Zone Services Confidence (DEC),16.4,u,10:00
1185,8,CAD,"Monday, January 8, 2018",,-,Low,CAD Business Outlook Future Sales (4Q),19,-,15:30
1186,-6.4,CAD,"Monday, January 8, 2018",,-,Low,CAD Bank of Canda Senior Loan Officer Survey (4Q),-0.5,-,15:30
1187,,USD,"Monday, January 8, 2018",,-,Low,USD U.S. to Sell USD48 Bln 3-Month Bills,,-,16:30
1188,,USD,"Monday, January 8, 2018",,-,Low,USD U.S. to Sell USD42 Bln 6-Month Bills,,-,16:30
1189,,USD,"Monday, January 8, 2018",,-,Low,USD Fed's Bostic Speaks on Economic Outlook in Atlanta,,-,17:40
1190,,USD,"Monday, January 8, 2018",,-,Low,USD Fed's Williams Speaks at Inflation Targeting Conference,,-,18:35
1191,$27.951b,USD,"Monday, January 8, 2018",$18.000b,u,Medium,USD Consumer Credit (NOV),$20.532b,u,20:00
1192,,USD,"Monday, January 8, 2018",,-,Low,USD Fed's Rosengren Speaks at Inflation Targeting Conference,,-,21:00
1193,122.0,AUD,"Monday, January 8, 2018",,-,Low,AUD ANZ Roy Morgan Weekly Consumer Confidence Index (JAN 07),116.5,-,22:30
1194,0.9%,JPY,"Tuesday, January 9, 2018",0.6%,u,Medium,JPY Labor Cash Earnings (YoY) (NOV),0.2%,d,00:00
1195,0.1%,JPY,"Tuesday, January 9, 2018",-0.1%,u,Medium,JPY Real Cash Earnings (YoY) (NOV),-0.1%,d,00:00
1196,0.6%,GBP,"Tuesday, January 9, 2018",0.3%,u,Low,GBP BRC Sales Like-For-Like (YoY) (DEC),0.6%,-,00:01
1197,11.7%,AUD,"Tuesday, January 9, 2018",-1.3%,u,Low,AUD Building Approvals (MoM) (NOV),-0.1%,d,00:30
1198,17.1%,AUD,"Tuesday, January 9, 2018",4.6%,u,Medium,AUD Building Approvals (YoY) (NOV),17.5%,d,00:30
1199,-2.3%,AUD,"Tuesday, January 9, 2018",,-,Low,AUD ANZ Job Advertisements (MoM) (DEC),1.1%,d,00:30
1200,,JPY,"Tuesday, January 9, 2018",,-,Low,JPY BOJ Outright Bond Purchase 10~25 Years,,-,01:10
1201,,JPY,"Tuesday, January 9, 2018",,-,Low,JPY BOJ Outright Bond Purchase 25 Years~,,-,01:10
1202,44.7,JPY,"Tuesday, January 9, 2018",45.0,d,Medium,JPY Consumer Confidence Index (DEC),44.9,-,05:00
1203,,CHF,"Tuesday, January 9, 2018",,-,Low,CHF SNB Prelimary Full-Year Results,,-,06:25
1204,3.3%,CHF,"Tuesday, January 9, 2018",3.2%,d,Medium,CHF Unemployment Rate (DEC),3.1%,-,06:45
1205,3.0%,CHF,"Tuesday, January 9, 2018",3.0%,-,Medium,CHF Unemployment Rate s.a. (DEC),3.1%,d,06:45
1206,3.4%,EUR,"Tuesday, January 9, 2018",1.8%,u,Low,EUR German Industrial Production s.a. (MoM) (NOV),-1.2%,u,07:00
1207,5.6%,EUR,"Tuesday, January 9, 2018",3.9%,u,Medium,EUR German Industrial Production n.s.a. and w.d.a. (YoY) (NOV),2.8%,u,07:00
1208,23.7b,EUR,"Tuesday, January 9, 2018",21.3b,u,Medium,EUR German Trade Balance (NOV),18.9b,-,07:00
1209,25.4b,EUR,"Tuesday, January 9, 2018",25.5b,d,Low,EUR German Current Account (euros) (NOV),18.1b,-,07:00
1210,4.1%,EUR,"Tuesday, January 9, 2018",1.2%,u,Low,EUR German Exports s.a. (MoM) (NOV),-0.3%,u,07:00
1211,2.3%,EUR,"Tuesday, January 9, 2018",0.4%,u,Low,EUR German Imports s.a. (MoM) (NOV),1.8%,-,07:00
1212,743.9b,CHF,"Tuesday, January 9, 2018",,-,Low,CHF Foreign Currency Reserves (DEC),738.1b,d,08:00
1213,-0.2%,CHF,"Tuesday, January 9, 2018",,-,Medium,CHF Retail Sales Real (YoY) (NOV),-2.6%,u,08:15
1214,8.7%,EUR,"Tuesday, January 9, 2018",8.7%,-,Medium,EUR Euro-Zone Unemployment Rate (NOV),8.8%,-,10:00
1215,104.9,USD,"Tuesday, January 9, 2018",107.8,d,Low,USD NFIB Small Business Optimism (DEC),107.5,-,11:00
1216,217k,CAD,"Tuesday, January 9, 2018",211k,u,Medium,CAD Housing Starts (DEC),251.7k,d,13:15
1217,5879,USD,"Tuesday, January 9, 2018",6025,d,Low,USD JOLTS Job Openings (NOV),5925,d,15:00
1218,,USD,"Tuesday, January 9, 2018",,-,Low,USD Fed's Kashkari Speaks on Moderated Panel,,-,15:00
1219,,USD,"Tuesday, January 9, 2018",,-,Low,USD U.S. to Sell 4-Week Bills,,-,16:30
1220,,USD,"Tuesday, January 9, 2018",,-,Low,USD U.S. to Sell USD24 Bln 3-Year Notes,,-,18:00
1221,2.7%,AUD,"Wednesday, January 10, 2018",,-,Low,AUD Job vacancies (NOV),6.7%,d,00:30
1222,4.9%,CNY,"Wednesday, January 10, 2018",4.8%,u,Medium,CNY Producer Price Index (YoY) (DEC),5.8%,-,01:30
1223,1.8%,CNY,"Wednesday, January 10, 2018",1.9%,d,High,CNY Consumer Price Index (YoY) (DEC),1.7%,-,01:30
1224,0.4%,GBP,"Wednesday, January 10, 2018",0.4%,-,Low,GBP Industrial Production (MoM) (NOV),0.2%,u,09:30
1225,2.5%,GBP,"Wednesday, January 10, 2018",1.8%,u,Medium,GBP Industrial Production (YoY) (NOV),4.3%,u,09:30
1226,0.4%,GBP,"Wednesday, January 10, 2018",0.3%,u,Low,GBP Manufacturing Production (MoM) (NOV),0.3%,u,09:30
1227,3.5%,GBP,"Wednesday, January 10, 2018",2.8%,u,Medium,GBP Manufacturing Production (YoY) (NOV),4.7%,u,09:30
1228,0.4%,GBP,"Wednesday, January 10, 2018",0.8%,d,Low,GBP Construction Output SA (MoM) (NOV),-1.1%,u,09:30
1229,0.4%,GBP,"Wednesday, January 10, 2018",-1.0%,u,Medium,GBP Construction Output SA (YoY) (NOV),1.3%,u,09:30
1230,"-£12,231",GBP,"Wednesday, January 10, 2018","-£10,950",d,Medium,GBP Visible Trade Balance (Pounds) (NOV),"-£11,677",d,09:30
1231,"-£4,675",GBP,"Wednesday, January 10, 2018","-£2,600",d,Medium,GBP Trade Balance Non EU GBP/Mn (NOV),"-£3,374",d,09:30
1232,"-£2,804",GBP,"Wednesday, January 10, 2018","-£1,500",d,Medium,GBP Trade Balance (NOV),"-£2,270",d,09:30
1233,8.3%,USD,"Wednesday, January 10, 2018",,-,Medium,USD MBA Mortgage Applications (JAN 05),-1.6%,d,12:00
1234,0.6%,GBP,"Wednesday, January 10, 2018",0.5%,u,Medium,GBP NIESR Gross Domestic Product Estimate (DEC),0.6%,u,13:00
1235,-7.7%,CAD,"Wednesday, January 10, 2018",-1.0%,d,Medium,CAD Building Permits (MoM) (NOV),4.4%,u,13:30
