,actual,country,date,forecast,forecast_error,impact,new,previous,previous_error,time
744,0.6%,EUR,"Tuesday, January 30, 2018",0.6%,-,Medium,EUR Euro-Zone Gross Domestic Product s.a. (QoQ) (4Q A),0.7%,u,10:00
745,2.7%,EUR,"Tuesday, January 30, 2018",2.7%,-,High,EUR Euro-Zone Gross Domestic Product s.a. (YoY) (4Q A),2.8%,u,10:00
746,1.3,EUR,"Tuesday, January 30, 2018",1.3,-,Low,EUR Euro-Zone Consumer Confidence (JAN F),1.3,-,10:00
747,-0.7%,EUR,"Tuesday, January 30, 2018",-0.6%,d,Medium,EUR German Consumer Price Index (MoM) (JAN P),0.6%,-,13:00
748,1.6%,EUR,"Tuesday, January 30, 2018",1.7%,d,High,EUR German Consumer Price Index (YoY) (JAN P),1.7%,-,13:00
749,204.21,USD,"Tuesday, January 30, 2018",,-,Low,USD S&P/Case-Shiller 20-City Index n.s.a (NOV),203.71,d,14:00
750,0.75%,USD,"Tuesday, January 30, 2018",0.6%,u,Medium,USD S&P CoreLogic CS 20-City (MoM) SA (NOV),0.7%,-,14:00
751,6.41%,USD,"Tuesday, January 30, 2018",6.3%,u,Medium,USD S&P/Case-Shiller Composite-20 (YoY) (NOV),6.32%,d,14:00
752,195.94,USD,"Tuesday, January 30, 2018",,-,Low,USD S&P/Case-Shiller US Home Price Index (NOV),195.48,d,14:00
753,6.21%,USD,"Tuesday, January 30, 2018",,-,Medium,USD S&P/Case-Shiller US Home Price Index (YoY) (NOV),6.10%,d,14:00
754,125.4,USD,"Tuesday, January 30, 2018",123.0,u,High,USD Consumer Confidence Index (JAN),123.1,u,15:00
755,155.3,USD,"Tuesday, January 30, 2018",,-,Medium,USD Conf. Board Present Situation (JAN),156.5,d,15:00
756,105.5,USD,"Tuesday, January 30, 2018",,-,Low,USD Conf. Board Expectations (JAN),100.8,u,15:00
757,,GBP,"Tuesday, January 30, 2018",,-,High,GBP Bank of England Governor Carney Speaks Before Lawmakers,,-,15:30
758,,USD,"Tuesday, January 30, 2018",,-,Low,USD U.S. to Sell USD20 Bln 52-Week Bills,,-,16:30
759,,USD,"Tuesday, January 30, 2018",,-,Low,USD U.S. to Sell 4-Week Bills,,-,16:30
760,,EUR,"Tuesday, January 30, 2018",,-,Low,EUR ECB's Mersch speaks in Frankfurt,,-,16:30
761,,JPY,"Tuesday, January 30, 2018",,-,Medium,JPY BOJ Summary of Opinions,,-,23:50
762,2.7%,JPY,"Tuesday, January 30, 2018",1.5%,u,Low,JPY Industrial Production (MoM) (DEC P),0.5%,-,23:50
763,4.2%,JPY,"Tuesday, January 30, 2018",3.3%,u,Medium,JPY Industrial Production (YoY) (DEC P),3.6%,-,23:50
764,2.77%,JPY,"Tuesday, January 30, 2018",,-,Medium,JPY Loans & Discounts Corp (YoY) (DEC),3.11%,-,23:50
765,-9,GBP,"Wednesday, January 31, 2018",-13,u,Medium,GBP GfK Consumer Confidence (JAN),-13,-,00:01
766,35,GBP,"Wednesday, January 31, 2018",,-,Low,GBP Lloyds Business Barometer (JAN),28,-,00:01
767,-0.5%,GBP,"Wednesday, January 31, 2018",-0.4%,d,Low,GBP BRC Shop Price Index (YoY) (JAN),-0.6%,-,00:01
768,0.6%,AUD,"Wednesday, January 31, 2018",0.7%,d,Medium,AUD Consumer Prices Index (QoQ) (4Q),0.6%,-,00:30
769,1.9%,AUD,"Wednesday, January 31, 2018",2.0%,d,High,AUD Consumer Prices Index (YoY) (4Q),1.8%,-,00:30
770,0.4%,AUD,"Wednesday, January 31, 2018",0.5%,d,Medium,AUD Consumer Prices Index RBA Trimmed Mean (QoQ) (4Q),0.4%,-,00:30
771,1.8%,AUD,"Wednesday, January 31, 2018",1.8%,-,Medium,AUD Consumer Prices Index RBA Trimmed Mean (YoY) (4Q),1.8%,-,00:30
772,0.4%,AUD,"Wednesday, January 31, 2018",0.4%,-,Medium,AUD Consumer Prices Index RBA Weighted Median (QoQ) (4Q),0.4%,u,00:30
773,2.0%,AUD,"Wednesday, January 31, 2018",1.9%,u,Medium,AUD Consumer Prices Index RBA Weighted Median (YoY) (4Q),1.9%,-,00:30
774,4.8%,AUD,"Wednesday, January 31, 2018",5.2%,d,Medium,AUD Private Sector Credit (YoY) (DEC),5.2%,d,00:30
775,0.3%,AUD,"Wednesday, January 31, 2018",0.5%,d,Low,AUD Private Sector Credit (MoM) (DEC),0.4%,d,00:30
776,51.3,CNY,"Wednesday, January 31, 2018",51.6,d,High,CNY Manufacturing PMI (JAN),51.6,-,00:56
777,55.3,CNY,"Wednesday, January 31, 2018",54.9,u,Medium,CNY Non-manufacturing PMI (JAN),55,-,01:00
778,,JPY,"Wednesday, January 31, 2018",,-,Low,JPY BOJ Outright Bond Purchase 1~3 Years,,-,01:10
779,,JPY,"Wednesday, January 31, 2018",,-,Low,JPY BOJ Outright Bond Purchase 3~5 Years,,-,01:10
780,,JPY,"Wednesday, January 31, 2018",,-,Low,JPY BOJ Outright Bond Purchase 10~25 Years,,-,01:10
781,,JPY,"Wednesday, January 31, 2018",,-,Low,JPY BOJ Outright Bond Purchase 25 Years,,-,01:10
782,,JPY,"Wednesday, January 31, 2018",,-,Low,JPY BOJ Iwata makes a speech in Oita,,-,01:30
783,,USD,"Wednesday, January 31, 2018",,-,High,USD US President Trump Delivers State of the Union Address,,-,02:00
784,1.3%,JPY,"Wednesday, January 31, 2018",,-,Low,JPY Vehicle Production (YoY) (DEC),0.9%,-,04:00
785,44.7,JPY,"Wednesday, January 31, 2018",44.9,d,Medium,JPY Consumer Confidence Index (JAN),44.7,-,05:00
786,-2.1%,JPY,"Wednesday, January 31, 2018",1.0%,d,Medium,JPY Housing Starts (YoY) (DEC),-0.4%,-,05:00
787,0.936M,JPY,"Wednesday, January 31, 2018",0.935m,u,Low,JPY Annualized Housing Starts (DEC),0.951m,-,05:00
788,-8.1%,JPY,"Wednesday, January 31, 2018",,-,Medium,JPY Construction Orders (YoY) (DEC),20.5%,-,05:00
789,,CHF,"Wednesday, January 31, 2018",,-,Low,CHF Swiss National Bank Releases 4Q 2017 Currency Allocation,,-,06:30
790,-1.9%,EUR,"Wednesday, January 31, 2018",-0.4%,d,Low,EUR German Retail Sales (MoM) (DEC),1.9%,u,07:00
791,-1.9%,EUR,"Wednesday, January 31, 2018",2.8%,d,Medium,EUR German Retail Sales (YoY) (DEC),4.3%,d,07:00
792,1.69,CHF,"Wednesday, January 31, 2018",,-,Medium,CHF UBS Consumption Indicator (DEC),1.73,u,07:00
793,-25k,EUR,"Wednesday, January 31, 2018",-17k,u,High,EUR German Unemployment Change (000's) (JAN),-30k,u,08:55
794,5.4%,EUR,"Wednesday, January 31, 2018",5.4%,-,High,EUR German Unemployment Claims Rate s.a. (JAN),5.5%,-,08:55
795,34.5,CHF,"Wednesday, January 31, 2018",,-,Low,CHF Credit Suisse Survey Expectations (JAN),52,-,09:00
796,,EUR,"Wednesday, January 31, 2018",,-,Low,EUR ECB's Coeure Speaks in Dublin,,-,09:50
797,8.7%,EUR,"Wednesday, January 31, 2018",8.7%,-,Medium,EUR Euro-Zone Unemployment Rate (DEC),8.7%,-,10:00
798,1.0%,EUR,"Wednesday, January 31, 2018",1.0%,-,High,EUR Euro-Zone Consumer Price Index Core (YoY) (JAN A),0.9%,-,10:00
799,1.3%,EUR,"Wednesday, January 31, 2018",1.2%,u,High,EUR Euro-Zone Consumer Price Index Estimate (YoY) (JAN),1.4%,-,10:00
800,-2.6%,USD,"Wednesday, January 31, 2018",,-,Medium,USD MBA Mortgage Applications (JAN 26),4.5%,-,12:00
801,234k,USD,"Wednesday, January 31, 2018",185k,u,Medium,USD ADP Employment Change (JAN),242k,d,13:15
802,0.6%,USD,"Wednesday, January 31, 2018",0.6%,-,Medium,USD Employment Cost Index (4Q),0.7%,-,13:30
803,0.4%,CAD,"Wednesday, January 31, 2018",0.4%,-,Medium,CAD Gross Domestic Product (MoM) (NOV),0.0%,-,13:30
804,3.5%,CAD,"Wednesday, January 31, 2018",3.4%,u,High,CAD Gross Domestic Product (YoY) (NOV),3.4%,-,13:30
805,-0.1%,CAD,"Wednesday, January 31, 2018",-0.2%,u,Low,CAD Industrial Product Price (MoM) (DEC),1.4%,-,13:30
806,-0.9%,CAD,"Wednesday, January 31, 2018",-2.3%,u,Low,CAD Raw Materials Price Index (MoM) (DEC),5.4%,d,13:30
807,65.7,USD,"Wednesday, January 31, 2018",64,u,Medium,USD Chicago Purchasing Manager (JAN),67.8,u,14:45
808,0.5%,USD,"Wednesday, January 31, 2018",0.5%,-,Low,USD Pending Home Sales (MoM) (DEC),0.3%,u,15:00
809,-1.8%,USD,"Wednesday, January 31, 2018",1.7%,d,Medium,USD Pending Home Sales (YoY) (DEC),0.6%,-,15:00
810,-1980k,USD,"Wednesday, January 31, 2018",2000k,u,Low,USD DOE U.S. Gasoline Inventories (JAN 26),3098k,-,15:30
811,6776k,USD,"Wednesday, January 31, 2018",900k,d,Medium,USD DOE U.S. Crude Oil Inventories (JAN 26),-1071k,-,15:30
812,-2224k,USD,"Wednesday, January 31, 2018",,-,Low,USD DOE Cushing OK Crude Inventory (JAN 26),-3150k,-,15:30
813,-1940k,USD,"Wednesday, January 31, 2018",-700k,u,Low,USD DOE U.S. Distillate Inventory (JAN 26),639k,-,15:30
814,1.50%,USD,"Wednesday, January 31, 2018",1.50%,-,High,USD FOMC Rate Decision (Upper Bound) (JAN 31),1.50%,-,19:00
815,1.25%,USD,"Wednesday, January 31, 2018",1.25%,-,High,USD FOMC Rate Decision (Lower Bound) (JAN 31),1.25%,-,19:00
816,3.1%,NZD,"Wednesday, January 31, 2018",,-,Low,NZD ANZ Job Advertisements (MoM) (JAN),0.0%,u,21:00
817,55.4,AUD,"Wednesday, January 31, 2018",,-,Low,AUD CBA Australia PMI Mfg (JAN),57.1,-,22:00
818,58.7,AUD,"Wednesday, January 31, 2018",,-,Medium,AUD AiG Performance of Manufacturing Index (JAN),56.2,-,22:30
819,-0.5%,AUD,"Wednesday, January 31, 2018",,-,Low,AUD CoreLogic House Px (MoM) (JAN),-0.4%,-,23:00
820,¥41.1b,JPY,"Wednesday, January 31, 2018",,-,Low,JPY Japan Buying Foreign Bonds (Yen) (JAN 26),¥390.9b,d,23:50
821,¥374.5b,JPY,"Wednesday, January 31, 2018",,-,Low,JPY Japan Buying Foreign Stocks (Yen) (JAN 26),¥379.8b,-,23:50
822,-¥253.6b,JPY,"Wednesday, January 31, 2018",,-,Low,JPY Foreign Buying Japan Bonds (JAN 26),-¥414.5b,d,23:50
823,-¥300.5b,JPY,"Wednesday, January 31, 2018",,-,Low,JPY Foreign Buying Japan Stocks (JAN 26),-¥148.1b,u,23:50
824,13.10m,USD,"Thursday, February 1, 2018",13.45m,-,Low,USD Domestic Vehicle Sales (JAN),13.72m,-,
825,17.07m,USD,"Thursday, February 1, 2018",17.20m,-,Low,USD Wards Total Vehicle Sales (JAN),17.76m,-,
826,2.0%,AUD,"Thursday, February 1, 2018",1.5%,u,Low,AUD Import price index (QoQ) (4Q),-1.6%,-,00:30
827,2.8%,AUD,"Thursday, February 1, 2018",2.0%,u,Low,AUD Export Price Index (QoQ) (4Q),-3.0%,-,00:30
828,-20.0%,AUD,"Thursday, February 1, 2018",-7.6%,d,Low,AUD Building Approvals (MoM) (DEC),12.6%,u,00:30
829,-5.5%,AUD,"Thursday, February 1, 2018",11.5%,d,Medium,AUD Building Approvals (YoY) (DEC),18.1%,u,00:30
830,54.8,JPY,"Thursday, February 1, 2018",,-,Low,JPY Nikkei Japan PMI Manufacturing (JAN F),54.4,-,00:30
831,51.5,CNY,"Thursday, February 1, 2018",51.5,-,Medium,CNY Caixin China PMI Mfg (JAN),51.5,-,01:45
832,-5.7%,JPY,"Thursday, February 1, 2018",,-,Low,JPY Vehicle Sales (YoY) (JAN),-1.0%,-,05:00
833,135.3,AUD,"Thursday, February 1, 2018",,-,Low,AUD Commodity Index AUD (JAN),129.3,d,05:30
834,-0.6%,AUD,"Thursday, February 1, 2018",,-,Low,AUD RBA Commodity Index SDR (YoY) (JAN),-6.0%,d,05:30
835,5,CHF,"Thursday, February 1, 2018",2,u,Medium,CHF SECO Consumer Confidence (JAN),-2,-,06:45
836,0.6%,GBP,"Thursday, February 1, 2018",0.1%,u,Low,GBP Nationwide House PX (MoM) (JAN),0.6%,-,07:00
837,3.2%,GBP,"Thursday, February 1, 2018",2.5%,u,Medium,GBP Nationwide House Px n.s.a. (YoY) (JAN),2.6%,-,07:00
838,0.6%,CHF,"Thursday, February 1, 2018",,-,Medium,CHF Retail Sales Real (YoY) (DEC),0.3%,u,08:15
839,65.3,CHF,"Thursday, February 1, 2018",64.2,u,Medium,CHF PMI Manufacturing (JAN),65.6,u,08:30
840,59.0,EUR,"Thursday, February 1, 2018",57.4,u,Low,EUR Markit/ADACI Italy Manufacturing PMI (JAN),57.4,-,08:45
841,58.4,EUR,"Thursday, February 1, 2018",58.1,u,Low,EUR Markit France Manufacturing PMI (JAN F),58.1,-,08:50
842,61.1,EUR,"Thursday, February 1, 2018",61.2,d,Low,EUR Markit/BME Germany Manufacturing PMI (JAN F),61.2,-,08:55
843,59.6,EUR,"Thursday, February 1, 2018",59.6,-,Low,EUR Markit Eurozone Manufacturing PMI (JAN F),59.6,-,09:00
844,55.3,GBP,"Thursday, February 1, 2018",56.5,d,Medium,GBP Markit UK PMI Manufacturing s.a. (JAN),56.2,d,09:30
845,,EUR,"Thursday, February 1, 2018",,-,Low,EUR ECB's Praet Speaks in Brussels,,-,11:15
846,0.5%,CAD,"Thursday, February 1, 2018",,-,Low,CAD MLI Leading Indicator (MoM) (DEC),0.5%,-,12:00
847,-2.8%,USD,"Thursday, February 1, 2018",,-,Low,USD Challenger Job Cuts (YoY) (JAN),-3.6%,-,12:30
848,-0.1%,USD,"Thursday, February 1, 2018",0.7%,d,Low,USD Nonfarm Productivity (4Q P),2.7%,d,13:30
849,2.0%,USD,"Thursday, February 1, 2018",0.9%,u,Low,USD Unit Labor Costs (4Q P),-0.1%,u,13:30
850,230k,USD,"Thursday, February 1, 2018",235k,u,Medium,USD Initial Jobless Claims (JAN 27),231k,u,13:30
851,1953k,USD,"Thursday, February 1, 2018",1929k,d,Medium,USD Continuing Claims (JAN 20),1940k,d,13:30
852,55.9,CAD,"Thursday, February 1, 2018",,-,High,CAD RBC Canadian Manufacturing PMI (JAN),54.7,-,14:30
853,55.5,USD,"Thursday, February 1, 2018",55.5,-,Low,USD Markit US Manufacturing PMI (JAN F),55.5,-,14:45
854,0.7%,USD,"Thursday, February 1, 2018",0.4%,u,Medium,USD Construction Spending (MoM) (DEC),0.6%,d,15:00
855,59.1,USD,"Thursday, February 1, 2018",58.6,u,High,USD ISM Manufacturing (JAN),59.3,d,15:00
856,54.2,USD,"Thursday, February 1, 2018",,-,High,USD ISM Employment (JAN),58.1,u,15:00
857,72.7,USD,"Thursday, February 1, 2018",68.8,u,Medium,USD ISM Prices Paid (JAN),68.3,d,15:00
858,65.4,USD,"Thursday, February 1, 2018",,-,Low,USD ISM New Orders (JAN),67.4,d,15:00
859,-99,USD,"Thursday, February 1, 2018",-102,d,Low,USD EIA Working Natural Gas Implied Flow (JAN 26),-288,-,15:30
860,-99,USD,"Thursday, February 1, 2018",-102,d,Low,USD EIA Natural Gas Storage Change (JAN 26),-288,-,15:30
861,,GBP,"Thursday, February 1, 2018",,-,Low,GBP BOE's Brazier Speaks in London,,-,17:30
862,126.9,NZD,"Thursday, February 1, 2018",,-,Low,NZD ANZ Consumer Confidence Index (JAN),121.8,-,21:00
863,4.2%,NZD,"Thursday, February 1, 2018",,-,Low,NZD ANZ Consumer Confidence (MoM) (JAN),-1.5%,-,21:00
864,-9.6%,NZD,"Thursday, February 1, 2018",,-,Medium,NZD Building Permits (MoM) (DEC),9.6%,d,21:45
865,5700,NZD,"Thursday, February 1, 2018",,-,Low,NZD Net Migration s.a. (DEC),5660,u,21:45
866,9.7%,JPY,"Thursday, February 1, 2018",,-,Medium,JPY Monetary Base (YoY) (JAN),11.2%,-,23:50
867,¥476.7t,JPY,"Thursday, February 1, 2018",,-,Medium,JPY Monetary Base End of period (JAN),¥480.0t,-,23:50
868,0.6%,AUD,"Friday, February 2, 2018",,-,Low,AUD Producer Price Index (QoQ) (4Q),0.2%,-,00:30
869,1.7%,AUD,"Friday, February 2, 2018",,-,Low,AUD Producer Price Index (YoY) (4Q),1.6%,-,00:30
870,50.2,GBP,"Friday, February 2, 2018",52,d,Medium,GBP Markit/CIPS UK Construction PMI (JAN),52.2,-,09:30
871,0.2%,EUR,"Friday, February 2, 2018",0.2%,-,Low,EUR Euro-Zone Producer Price Index (MoM) (DEC),0.6%,-,10:00
872,2.2%,EUR,"Friday, February 2, 2018",2.3%,d,Low,EUR Euro-Zone Producer Price Index (YoY) (DEC),2.8%,-,10:00
873,,EUR,"Friday, February 2, 2018",,-,Low,"EUR ECB's Coeure Speaks in Kranj, Slovenia",,-,10:00
874,200k,USD,"Friday, February 2, 2018",180k,u,High,USD Change in Non-farm Payrolls (JAN),160k,u,13:30
875,196k,USD,"Friday, February 2, 2018",181k,u,Medium,USD Change in Private Payrolls (JAN),166k,u,13:30
876,15k,USD,"Friday, February 2, 2018",20k,d,Low,USD Change in Manufact. Payrolls (JAN),21k,d,13:30
877,4.1%,USD,"Friday, February 2, 2018",4.1%,-,High,USD Unemployment Rate (JAN),4.1%,-,13:30
878,8.2%,USD,"Friday, February 2, 2018",,-,Low,USD Underemployment Rate (JAN),8.1%,-,13:30
879,0.3%,USD,"Friday, February 2, 2018",0.2%,u,Low,USD Average Hourly Earnings (MoM) (JAN),0.4%,u,13:30
880,2.9%,USD,"Friday, February 2, 2018",2.6%,u,Medium,USD Average Hourly Earnings (YoY) (JAN),2.7%,u,13:30
881,34.3,USD,"Friday, February 2, 2018",34.5,d,Medium,USD Average Weekly Hours All Employees (JAN),34.5,-,13:30
882,62.7%,USD,"Friday, February 2, 2018",,-,Low,USD Labor Force Participation Rate (JAN),62.7%,-,13:30
883,1.7%,USD,"Friday, February 2, 2018",1.5%,u,Medium,USD Factory Orders (DEC),1.7%,u,15:00
884,0.7%,USD,"Friday, February 2, 2018",,-,Low,USD Factory Orders Ex Trans (DEC),1.1%,u,15:00
885,95.7,USD,"Friday, February 2, 2018",95,u,Medium,USD U. of Mich. Sentiment (JAN F),94.4,-,15:00
886,2.8%,USD,"Friday, February 2, 2018",,-,Medium,USD Durable Goods Orders (DEC F),2.9%,-,15:00
887,110.5,USD,"Friday, February 2, 2018",,-,Low,USD U. of Mich. Current Conditions (JAN F),109.2,-,15:00
888,0.7%,USD,"Friday, February 2, 2018",,-,Low,USD Durables Ex Transportation (DEC F),0.6%,-,15:00
889,86.3,USD,"Friday, February 2, 2018",,-,Low,USD U. of Mich. Expectations (JAN F),84.8,-,15:00
890,-0.6%,USD,"Friday, February 2, 2018",,-,Low,USD Cap Goods Orders Nondef Ex Air (DEC F),-0.3%,-,15:00
891,2.7%,USD,"Friday, February 2, 2018",,-,Low,USD U. of Mich. 1 Yr Inflation (JAN F),2.8%,-,15:00
892,0.4%,USD,"Friday, February 2, 2018",,-,Low,USD Cap Goods Ship Nondef Ex Air (DEC F),0.6%,-,15:00
893,2.5%,USD,"Friday, February 2, 2018",,-,Medium,USD U. of Mich. 5-10 Yr Inflation (JAN F),2.5%,-,15:00
894,946,USD,"Friday, February 2, 2018",944,d,Medium,USD Baker Hughes U.S. Rig Count (FEB 02),947,-,18:00
895,,USD,"Friday, February 2, 2018",,-,Low,USD Fed's Williams Speaks in San Francisco,,-,20:30
896,0.00%,JPY,"Tuesday, January 23, 2018",0.00%,-,High,JPY BOJ 10-Yr Yield Target (JAN 23),0.00%,-,03:14
897,,JPY,"Tuesday, January 23, 2018",,-,High,JPY BOJ Outlook Report,,-,03:14
898,-0.10%,JPY,"Tuesday, January 23, 2018",-0.10%,-,High,JPY BOJ Rate Decision (JAN 23),-0.10%,-,03:14
899,-0.6%,JPY,"Tuesday, January 23, 2018",,-,Low,JPY Nationwide Department Store Sales (YoY) (DEC),2.2%,-,03:40
900,0.9%,JPY,"Tuesday, January 23, 2018",,-,Low,JPY Tokyo Department Store Sales (YoY) (DEC),3.8%,-,03:40
901,1.0%,JPY,"Tuesday, January 23, 2018",0.8%,u,Medium,JPY All Industry Activity Index (MoM) (NOV),0.3%,-,04:30
902,48.3%,JPY,"Tuesday, January 23, 2018",,-,Low,JPY Machine Tool Orders (YoY) (DEC F),48.3%,-,06:00
903,25.1b,GBP,"Tuesday, January 23, 2018",,-,Medium,GBP Public Finances (PSNCR) (Pounds) (DEC),13.2b,u,09:30
904,18.8b,GBP,"Tuesday, January 23, 2018",,-,Medium,GBP Central Government NCR (DEC),12.4b,u,09:30
905,1b,GBP,"Tuesday, January 23, 2018",4.3b,d,Medium,GBP Public Sector Net Borrowing (DEC),6.6b,u,09:30
906,2.6b,GBP,"Tuesday, January 23, 2018",5.0b,d,Medium,GBP PSNB ex Banking Groups (DEC),8.3b,u,09:30
907,95.2,EUR,"Tuesday, January 23, 2018",89.5,u,Medium,EUR German ZEW Survey Current Situation (JAN),89.3,-,10:00
908,20.4,EUR,"Tuesday, January 23, 2018",17.7,u,High,EUR German ZEW Survey Expectations (JAN),17.4,-,10:00
909,31.8,EUR,"Tuesday, January 23, 2018",,-,High,EUR Euro-Zone ZEW Survey (Economic Sentiment) (JAN),29,-,10:00
910,14,GBP,"Tuesday, January 23, 2018",12,u,Low,GBP CBI Trends Total Orders (JAN),17,-,11:00
911,40,GBP,"Tuesday, January 23, 2018",,-,Low,GBP CBI Trends Selling Prices (JAN),23,-,11:00
912,13,GBP,"Tuesday, January 23, 2018",,-,Low,GBP CBI Business Optimism (JAN),-11,-,11:00
913,14,USD,"Tuesday, January 23, 2018",19,d,Low,USD Richmond Fed Manufact. Index (JAN),20,-,15:00
914,1.3,EUR,"Tuesday, January 23, 2018",0.6,u,Medium,EUR Euro-Zone Consumer Confidence (JAN A),0.5,-,15:00
915,,USD,"Tuesday, January 23, 2018",,-,Medium,USD Senate Holds Confirmation Hearing for Fed Nominee Goodfriend,,-,15:00
916,,USD,"Tuesday, January 23, 2018",,-,Low,USD U.S. to Sell 4-Week Bills,,-,16:30
917,,USD,"Tuesday, January 23, 2018",,-,Low,USD U.S. to Sell USD26 Bln 2-Year Notes,,-,18:00
918,0.27%,AUD,"Tuesday, January 23, 2018",,-,Medium,AUD Westpac Leading Index (MoM) (DEC),0.05%,d,23:30
919,,USD,"Tuesday, January 23, 2018",,-,Low,USD Fed's Evans Makes Introductory Remarks,,-,23:30
920,¥359.0b,JPY,"Tuesday, January 23, 2018",¥520.0b,d,Medium,JPY Trade Balance (DEC),¥112.2b,d,23:50
921,¥86.6b,JPY,"Tuesday, January 23, 2018",¥264.3b,d,Low,JPY Adjusted Merchandise Trade Balance (Yen) (DEC),¥289.6b,d,23:50
922,9.3%,JPY,"Tuesday, January 23, 2018",10.0%,d,Low,JPY Exports (YoY) (DEC),16.2%,-,23:50
923,14.9%,JPY,"Tuesday, January 23, 2018",12.4%,u,Low,JPY Imports (YoY) (DEC),17.2%,-,23:50
924,0.2%,AUD,"Wednesday, January 24, 2018",,-,Low,AUD Skilled Vacancies (MoM) (DEC),0.3%,-,00:00
925,54.4,JPY,"Wednesday, January 24, 2018",,-,Medium,JPY Nikkei Japan PMI Manufacturing (JAN P),54.0,-,00:30
926,,JPY,"Wednesday, January 24, 2018",,-,Low,JPY BOJ Outright Bond Purchase 1~3 Years,,-,01:10
927,,JPY,"Wednesday, January 24, 2018",,-,Low,JPY BOJ Outright Bond Purchase 3~5 Years,,-,01:10
928,,JPY,"Wednesday, January 24, 2018",,-,Low,JPY BOJ Outright Bond Purchase 5~10 Years,,-,01:10
929,0.6%,NZD,"Wednesday, January 24, 2018",,-,Low,NZD Credit Card Spending (MoM) (DEC),0.9%,u,02:00
930,6.3%,NZD,"Wednesday, January 24, 2018",,-,Medium,NZD Credit Card Spending (YoY) (DEC),9.1%,-,02:00
931,108.3,JPY,"Wednesday, January 24, 2018",,-,Low,JPY Leading Index CI (NOV F),108.6,-,05:00
932,117.9,JPY,"Wednesday, January 24, 2018",,-,Low,JPY Coincident Index (NOV F),118.1,-,05:00
933,58.1,EUR,"Wednesday, January 24, 2018",58.6,d,Low,EUR Markit France Manufacturing PMI (JAN P),58.8,-,08:00
934,59.3,EUR,"Wednesday, January 24, 2018",58.9,u,Low,EUR Markit France Services PMI (JAN P),59.1,-,08:00
935,59.7,EUR,"Wednesday, January 24, 2018",59.2,u,Low,EUR Markit France Composite PMI (JAN P),59.6,-,08:00
936,61.2,EUR,"Wednesday, January 24, 2018",63,d,Medium,EUR Markit/BME Germany Manufacturing PMI (JAN P),63.3,-,08:30
937,57,EUR,"Wednesday, January 24, 2018",55.5,u,Medium,EUR Markit Germany Services PMI (JAN P),55.8,-,08:30
938,58.8,EUR,"Wednesday, January 24, 2018",58.5,u,Medium,EUR Markit/BME Germany Composite PMI (JAN P),58.9,-,08:30
939,59.6,EUR,"Wednesday, January 24, 2018",60.3,d,Medium,EUR Markit Eurozone Manufacturing PMI (JAN P),60.6,-,09:00
940,57.6,EUR,"Wednesday, January 24, 2018",56.4,u,Medium,EUR Markit Eurozone Services PMI (JAN P),56.6,-,09:00
941,58.6,EUR,"Wednesday, January 24, 2018",57.9,u,Medium,EUR Markit Eurozone Composite PMI (JAN P),58.1,-,09:00
942,2.4%,GBP,"Wednesday, January 24, 2018",,-,Medium,GBP Claimant Count Rate (DEC),2.3%,-,09:30
943,8.6k,GBP,"Wednesday, January 24, 2018",,-,Medium,GBP Jobless Claims Change (DEC),12.2k,u,09:30
944,2.5%,GBP,"Wednesday, January 24, 2018",2.5%,-,Medium,GBP Average Weekly Earnings (3M/YoY) (NOV),2.5%,-,09:30
945,2.4%,GBP,"Wednesday, January 24, 2018",2.3%,u,Medium,GBP Weekly Earnings ex Bonus (3M/YoY) (NOV),2.3%,-,09:30
946,4.3%,GBP,"Wednesday, January 24, 2018",4.3%,-,Medium,GBP ILO Unemployment Rate 3Mths (NOV),4.3%,-,09:30
947,102k,GBP,"Wednesday, January 24, 2018",-12k,u,Medium,GBP Employment Change 3M/3M (NOV),-56k,-,09:30
948,,CNY,"Wednesday, January 24, 2018",,-,Medium,CNY China Economic Adviser Liu He Speaks in Davos,,-,09:50
949,4.5%,USD,"Wednesday, January 24, 2018",,-,Medium,USD MBA Mortgage Applications (JAN 19),4.1%,-,12:00
950,0.4%,USD,"Wednesday, January 24, 2018",0.5%,d,Medium,USD House Price Index (MoM) (NOV),0.5%,-,14:00
951,55.5,USD,"Wednesday, January 24, 2018",55,u,Medium,USD Markit US Manufacturing PMI (JAN P),55.1,-,14:45
952,53.3,USD,"Wednesday, January 24, 2018",54.3,d,Medium,USD Markit US Services PMI (JAN P),53.7,-,14:45
953,53.8,USD,"Wednesday, January 24, 2018",,-,Medium,USD Markit US Composite PMI (JAN P),54.1,-,14:45
954,5.57m,USD,"Wednesday, January 24, 2018",5.70m,d,Low,USD Existing Home Sales (DEC),5.78m,d,15:00
955,-3.6%,USD,"Wednesday, January 24, 2018",-1.9%,d,Medium,USD Existing Home Sales (MoM) (DEC),5.1%,d,15:00
956,3098k,USD,"Wednesday, January 24, 2018",2200k,d,Low,USD DOE U.S. Gasoline Inventories (JAN 19),3620k,-,15:30
957,-1071k,USD,"Wednesday, January 24, 2018",-2000k,d,Medium,USD DOE U.S. Crude Oil Inventories (JAN 19),-6861k,-,15:30
958,3150k,USD,"Wednesday, January 24, 2018",,-,Low,USD DOE Cushing OK Crude Inventory (JAN 19),-4184k,-,15:30
959,639k,USD,"Wednesday, January 24, 2018",-1100k,d,Low,USD DOE U.S. Distillate Inventory (JAN 19),-3887k,-,15:30
960,,USD,"Wednesday, January 24, 2018",,-,Low,USD U.S. to Sell USD15 Bln 2-Year Floating Rate Notes,,-,16:30
961,,USD,"Wednesday, January 24, 2018",,-,Low,USD U.S. to Sell USD34 Bln 5-Year Notes,,-,18:00
962,0.1%,NZD,"Wednesday, January 24, 2018",0.4%,d,Medium,NZD Consumer Price Index (QoQ) (4Q),0.5%,-,21:45
963,1.6%,NZD,"Wednesday, January 24, 2018",1.9%,d,High,NZD Consumer Price Index (YoY) (4Q),1.9%,-,21:45
964,¥411.1b,JPY,"Wednesday, January 24, 2018",,-,Low,JPY Japan Buying Foreign Bonds (Yen) (JAN 19),¥957.8b,u,23:50
965,¥379.8b,JPY,"Wednesday, January 24, 2018",,-,Low,JPY Japan Buying Foreign Stocks (Yen) (JAN 19),¥93.1b,u,23:50
966,¥-413.4b,JPY,"Wednesday, January 24, 2018",,-,Low,JPY Foreign Buying Japan Bonds (JAN 19),¥87.7b,u,23:50
967,¥-148.2b,JPY,"Wednesday, January 24, 2018",,-,Low,JPY Foreign Buying Japan Stocks (JAN 19),¥499.4b,u,23:50
968,0.9%,JPY,"Thursday, January 25, 2018",,-,Low,JPY Supermarket Sales (YoY) (DEC),-0.6%,-,05:00
969,11.0,EUR,"Thursday, January 25, 2018",10.8,u,Medium,EUR German GfK Consumer Confidence (FEB),10.8,-,07:00
970,117.6,EUR,"Thursday, January 25, 2018",117,u,Medium,EUR German IFO Business Climate (JAN),117.2,-,09:00
971,108.4,EUR,"Thursday, January 25, 2018",109.2,d,Medium,EUR German IFO Expectations (JAN),109.4,d,09:00
972,127.7,EUR,"Thursday, January 25, 2018",125.3,u,Medium,EUR German IFO Current Assessment (JAN),125.5,u,09:00
973,36115,GBP,"Thursday, January 25, 2018",39800,d,Medium,GBP BBA Loans for House Purchase (DEC),39007,d,09:30
974,12,GBP,"Thursday, January 25, 2018",13,d,Low,GBP CBI Reported Sales (JAN),20,-,11:00
975,14,GBP,"Thursday, January 25, 2018",,-,Low,GBP CBI Total Dist. Reported Sales (JAN),24,-,11:00
976,62.7,CAD,"Thursday, January 25, 2018",,-,Low,CAD CFIB Business Barometer (JAN),59.7,-,11:27
977,0.00%,EUR,"Thursday, January 25, 2018",0.00%,-,High,EUR European Central Bank Rate Decision (JAN 25),0.00%,-,12:45
978,0.25%,EUR,"Thursday, January 25, 2018",0.25%,-,High,EUR ECB Marginal Lending Facility (JAN 25),0.25%,-,12:45
979,-0.40%,EUR,"Thursday, January 25, 2018",-0.40%,-,High,EUR ECB Deposit Facility Rate (JAN 25),-0.40%,-,12:45
980,,EUR,"Thursday, January 25, 2018",,-,High,EUR ECB President Draghi holds press conference in Frankfurt,,-,13:30
981,233k,USD,"Thursday, January 25, 2018",235k,u,Medium,USD Initial Jobless Claims (JAN 20),216k,u,13:30
982,1937k,USD,"Thursday, January 25, 2018",1925k,d,Medium,USD Continuing Claims (JAN 13),1965k,d,13:30
983,0.2%,CAD,"Thursday, January 25, 2018",0.8%,d,Medium,CAD Retail Sales (MoM) (NOV),1.6%,u,13:30
984,1.6%,CAD,"Thursday, January 25, 2018",0.9%,u,Low,CAD Retail Sales Ex Auto (MoM) (NOV),0.8%,-,13:30
985,625k,USD,"Thursday, January 25, 2018",675k,d,Low,USD New Home Sales (DEC),689k,d,15:00
986,-9.3%,USD,"Thursday, January 25, 2018",-7.9%,d,Medium,USD New Home Sales (MoM) (DEC),15.0%,d,15:00
987,0.6%,USD,"Thursday, January 25, 2018",0.5%,u,Medium,USD Leading Index (DEC),0.5%,u,15:00
988,-288,USD,"Thursday, January 25, 2018",-277,u,Low,USD EIA Working Natural Gas Implied Flow (JAN 19),-183,-,15:30
989,-288,USD,"Thursday, January 25, 2018",-277,u,Low,USD EIA Natural Gas Storage Change (JAN 19),-183,-,15:30
990,16,USD,"Thursday, January 25, 2018",14,u,Low,USD Kansas City Fed Manf. Activity (JAN),14,-,16:00
