,actual,country,date,forecast,forecast_error,impact,new,previous,previous_error,time
492,2.0%,EUR,"Friday, February 16, 2018",,-,Low,EUR German Wholesale Price Index (YoY) (JAN),1.8%,-,07:00
493,,EUR,"Friday, February 16, 2018",,-,Low,"EUR ECB's Coeure Speaks in Skopje, Macedonia",,-,08:20
494,0.1%,GBP,"Friday, February 16, 2018",0.6%,d,Low,GBP Retail Sales Ex Auto Fuel (MoM) (JAN),-1.5%,u,09:30
495,1.5%,GBP,"Friday, February 16, 2018",2.4%,d,Medium,GBP Retail Sales Ex Auto Fuel (YoY) (JAN),1.3%,-,09:30
496,0.1%,GBP,"Friday, February 16, 2018",0.5%,d,Low,GBP Retail Sales Inc Auto Fuel (MoM) (JAN),-1.4%,u,09:30
497,1.6%,GBP,"Friday, February 16, 2018",2.5%,d,Low,GBP Retail Sales Inc Auto Fuel (YoY) (JAN),1.5%,u,09:30
498,-0.3%,CAD,"Friday, February 16, 2018",0.3%,d,Low,CAD Manufacturing Sales (MoM) (DEC),3.8%,u,13:30
499,-1.97b,CAD,"Friday, February 16, 2018",,-,Low,CAD International Securities Transactions (Canadian dollar) (DEC),19.20b,d,13:30
500,1.0%,USD,"Friday, February 16, 2018",0.6%,u,Low,USD Import Price Index (MoM) (JAN),0.2%,u,13:30
501,0.5%,USD,"Friday, February 16, 2018",0.1%,u,Medium,USD Import Price Index ex Petroleum (MoM) (JAN),-0.2%,-,13:30
502,3.6%,USD,"Friday, February 16, 2018",3.0%,u,Low,USD Import Price Index (YoY) (JAN),3.2%,u,13:30
503,0.8%,USD,"Friday, February 16, 2018",0.3%,u,Low,USD Export Price Index (MoM) (JAN),0.1%,u,13:30
504,3.4%,USD,"Friday, February 16, 2018",,-,Medium,USD Export Price Index (YoY) (JAN),2.8%,u,13:30
505,1326k,USD,"Friday, February 16, 2018",1234k,u,Low,USD Housing Starts (JAN),1209k,u,13:30
506,9.7%,USD,"Friday, February 16, 2018",3.5%,u,Medium,USD Housing Starts (MoM) (JAN),-6.9%,u,13:30
507,1396k,USD,"Friday, February 16, 2018",1300k,u,Low,USD Building Permits (JAN),1300k,d,13:30
508,7.4%,USD,"Friday, February 16, 2018",0.0%,u,Medium,USD Building Permits (MoM) (JAN),-0.2%,d,13:30
509,99.9,USD,"Friday, February 16, 2018",95.5,u,High,USD U. of Mich. Sentiment (FEB P),95.7,-,15:00
510,115.1,USD,"Friday, February 16, 2018",111.7,u,Low,USD U. of Mich. Current Conditions (FEB P),110.5,-,15:00
511,90.2,USD,"Friday, February 16, 2018",87.2,u,Low,USD U. of Mich. Expectations (FEB P),86.3,-,15:00
512,2.7%,USD,"Friday, February 16, 2018",,-,Low,USD U. of Mich. 1 Yr Inflation (FEB P),2.7%,-,15:00
513,2.5%,USD,"Friday, February 16, 2018",,-,Low,USD U. of Mich. 5-10 Yr Inflation (FEB P),2.5%,-,15:00
514,975,USD,"Friday, February 16, 2018",973,d,Medium,USD Baker Hughes U.S. Rig Count (16 FEB),975,-,18:00
515,0.3%,AUD,"Monday, February 5, 2018",,-,Low,AUD TD Securities Inflation (MoM) (JAN),0.1%,-,00:00
516,2.0%,AUD,"Monday, February 5, 2018",,-,Medium,AUD TD Securities Inflation (YoY) (JAN),2.3%,-,00:00
517,0.7%,NZD,"Monday, February 5, 2018",,-,Low,NZD ANZ Commodity Price (JAN),-1.9%,u,00:00
518,51.9,JPY,"Monday, February 5, 2018",,-,Medium,JPY Nikkei Japan PMI Services (JAN),51.1,-,00:30
519,52.8,JPY,"Monday, February 5, 2018",,-,Medium,JPY Nikkei Japan PMI Composite (JAN),52.2,-,00:30
520,6.2%,AUD,"Monday, February 5, 2018",,-,Low,AUD ANZ Job Advertisements (MoM) (JAN),-2.7%,d,00:30
521,53.7,CNY,"Monday, February 5, 2018",,-,Medium,CNY Caixin China PMI Composite (JAN),53.0,-,01:45
522,54.7,CNY,"Monday, February 5, 2018",53.5,u,Medium,CNY Caixin China PMI Services (JAN),53.9,-,01:45
523,57.7,EUR,"Monday, February 5, 2018",55.9,u,Low,EUR Markit/ADACI Italy Services PMI (JAN),55.4,-,08:45
524,59.0,EUR,"Monday, February 5, 2018",57.4,u,Low,EUR Markit/ADACI Italy Composite PMI (JAN),56.5,-,08:45
525,59.2,EUR,"Monday, February 5, 2018",59.3,d,Low,EUR Markit France Services PMI (JAN F),59.3,-,08:50
526,59.6,EUR,"Monday, February 5, 2018",59.7,d,Low,EUR Markit France Composite PMI (JAN F),59.7,-,08:50
527,57.3,EUR,"Monday, February 5, 2018",57.0,u,Low,EUR Markit Germany Services PMI (JAN F),57.0,-,08:55
528,59.0,EUR,"Monday, February 5, 2018",58.8,u,Low,EUR Markit/BME Germany Composite PMI (JAN F),58.8,-,08:55
529,574.7b,CHF,"Monday, February 5, 2018",,-,Low,CHF Total Sight Deposits CHF (2 FEB),575.0b,-,09:00
530,465.4b,CHF,"Monday, February 5, 2018",,-,Low,CHF Domestic Sight Deposits CHF (2 FEB),465.1b,-,09:00
531,58.0,EUR,"Monday, February 5, 2018",57.6,u,Low,EUR Markit Eurozone Services PMI (JAN F),57.6,-,09:00
532,58.8,EUR,"Monday, February 5, 2018",58.6,u,Low,EUR Markit Eurozone Composite PMI (JAN F),58.6,-,09:00
533,$1709,GBP,"Monday, February 5, 2018",,-,Low,GBP Official Reserves (Changes) (JAN),-$44m,-,09:30
534,53.0,GBP,"Monday, February 5, 2018",54.1,d,Medium,GBP Markit/CIPS UK Services PMI (JAN),54.2,-,09:30
535,53.5,GBP,"Monday, February 5, 2018",54.6,d,Medium,GBP Markit/CIPS UK Composite PMI (JAN),54.9,-,09:30
536,31.9,EUR,"Monday, February 5, 2018",33.2,d,Low,EUR Euro-Zone Sentix Investor Confidence (FEB),32.9,-,09:30
537,-1.1%,EUR,"Monday, February 5, 2018",-1.0%,d,Low,EUR Euro-Zone Retail Sales (MoM) (DEC),2.0%,u,10:00
538,1.9%,EUR,"Monday, February 5, 2018",1.9%,-,Medium,EUR Euro-Zone Retail Sales (YoY) (DEC),3.9%,u,10:00
539,53.3,USD,"Monday, February 5, 2018",53.3,-,Low,USD Markit US Services PMI (JAN F),53.3,-,14:45
540,53.8,USD,"Monday, February 5, 2018",,-,Low,USD Markit US Composite PMI (JAN F),53.8,-,14:45
541,59.9,USD,"Monday, February 5, 2018",56.7,u,High,USD ISM Non-Manufacturing/Services Composite (JAN),56,u,15:00
542,,EUR,"Monday, February 5, 2018",,-,High,EUR ECB's Draghi in European Parliament in Strasbourg,,-,16:00
543,,USD,"Monday, February 5, 2018",,-,Low,USD U.S. to Sell USD48 Bln 3-Month Bills,,-,16:30
544,,USD,"Monday, February 5, 2018",,-,Low,USD U.S. to Sell USD42 Bln 6-Month Bills,,-,16:30
545,122.7,AUD,"Monday, February 5, 2018",,-,Low,AUD ANZ Roy Morgan Weekly Consumer Confidence Index (4 FEB),120.9,-,22:30
546,0.6%,GBP,"Tuesday, February 6, 2018",0.7%,d,Low,GBP BRC Sales Like-For-Like (YoY) (JAN),0.6%,-,00:01
547,-A$1358m,AUD,"Tuesday, February 6, 2018",A$200m,d,Medium,AUD Trade Balance (DEC),A$36m,u,00:30
548,-0.5%,AUD,"Tuesday, February 6, 2018",-0.2%,d,Low,AUD Retail Sales (MoM) (DEC),1.3%,u,00:30
549,0.9%,AUD,"Tuesday, February 6, 2018",1.0%,d,Medium,AUD Retail Sales Ex Inflation (QoQ) (4Q),0.1%,-,00:30
550,1.50%,AUD,"Tuesday, February 6, 2018",1.50%,-,High,AUD RBA Cash Rate Target (6 FEB),1.50%,-,03:30
551,3.8%,EUR,"Tuesday, February 6, 2018",0.7%,u,Low,EUR German Factory Orders (MoM) (DEC),-0.1%,u,07:00
552,7.2%,EUR,"Tuesday, February 6, 2018",3.1%,u,Medium,EUR German Factory Orders n.s.a. (YoY) (DEC),9.1%,u,07:00
553,59.8,EUR,"Tuesday, February 6, 2018",,-,Medium,EUR Markit Germany Construction PMI (JAN),53.7,-,08:30
554,-6.3%,GBP,"Tuesday, February 6, 2018",,-,Low,GBP New Car Registrations (YoY) (JAN),-14.4%,-,09:00
555,47.3,EUR,"Tuesday, February 6, 2018",,-,Low,EUR Markit Italy Retail PMI (JAN),49.5,-,09:10
556,51.0,EUR,"Tuesday, February 6, 2018",,-,Low,EUR Markit France Retail PMI (JAN),53.0,-,09:10
557,53.0,EUR,"Tuesday, February 6, 2018",,-,Medium,EUR Markit Germany Retail PMI (JAN),55.1,-,09:10
558,50.8,EUR,"Tuesday, February 6, 2018",,-,Low,EUR Markit Eurozone Retail PMI (JAN),53.0,-,09:10
559,-3.19b,CAD,"Tuesday, February 6, 2018",-2.32b,d,Low,CAD International Merchandise Trade (Canadian dollar) (DEC),-2.71b,d,13:30
560,-$53.1b,USD,"Tuesday, February 6, 2018",-$52.1b,d,Medium,USD Trade Balance (DEC),-$50.4b,u,13:30
561,,USD,"Tuesday, February 6, 2018",,-,Low,USD Fed's Bullard Speaks on U.S. Economy and Monetary Policy,,-,13:50
562,"$3,553",NZD,"Tuesday, February 6, 2018",,-,Medium,NZD Dairy Auction Avg. Winning Price MT (6 FEB),"$3,310",-,14:36
563,"$3,226",NZD,"Tuesday, February 6, 2018",,-,Medium,NZD Dairy Auction Whole Milk Powder MT (6 FEB),"$3,010",-,14:36
564,5811,USD,"Tuesday, February 6, 2018",5961,d,Low,USD JOLTS Job Openings (DEC),5978,u,15:00
565,55.2,CAD,"Tuesday, February 6, 2018",,-,Low,CAD Ivey Purchasing Managers Index s.a. (JAN),60.4,-,15:00
566,,USD,"Tuesday, February 6, 2018",,-,Low,USD U.S. to Sell 4-Week Bills,,-,16:30
567,,USD,"Tuesday, February 6, 2018",,-,Low,USD U.S. to Sell USD26 Bln 3-Year Notes,,-,18:00
568,4.5%,NZD,"Tuesday, February 6, 2018",4.7%,u,High,NZD Unemployment Rate (4Q),4.6%,-,21:45
569,0.5%,NZD,"Tuesday, February 6, 2018",0.4%,u,Medium,NZD Employment Change (QoQ) (4Q),2.2%,-,21:45
570,3.7%,NZD,"Tuesday, February 6, 2018",3.6%,u,High,NZD Employment Change (YoY) (4Q),4.2%,-,21:45
571,71.0%,NZD,"Tuesday, February 6, 2018",71.0%,-,Low,NZD Participation Rate (4Q),71.1%,-,21:45
572,0.4%,NZD,"Tuesday, February 6, 2018",0.5%,d,Low,NZD Labor Cost Private Sector (QoQ) (4Q),0.7%,-,21:45
573,0.4%,NZD,"Tuesday, February 6, 2018",0.5%,d,Low,NZD Private Wages ex Overtime (QoQ) (4Q),0.7%,-,21:45
574,0.8%,NZD,"Tuesday, February 6, 2018",0.5%,u,Low,NZD Average Hourly Earnings (QoQ) (4Q),1.2%,-,21:45
575,54.3,AUD,"Tuesday, February 6, 2018",,-,Medium,AUD AiG Performance of Construction Index (JAN),52.8,-,22:30
576,$1268.5b,JPY,"Tuesday, February 6, 2018",,-,Low,JPY Official Reserve Assets (JAN),$1264.3b,-,23:50
577,0.7%,JPY,"Wednesday, February 7, 2018",0.5%,u,Medium,JPY Labor Cash Earnings (YoY) (DEC),0.9%,-,00:00
578,-0.5%,JPY,"Wednesday, February 7, 2018",,-,Medium,JPY Real Cash Earnings (YoY) (DEC),0.1%,-,00:00
579,,JPY,"Wednesday, February 7, 2018",,-,Low,JPY BOJ Outright Bond Purchase 5~10 Years,,-,01:10
580,,JPY,"Wednesday, February 7, 2018",,-,Low,JPY BOJ Outright Bond Purchase 1~3 Years,,-,01:10
581,,JPY,"Wednesday, February 7, 2018",,-,Low,JPY BOJ Outright Bond Purchase 3~5 Years,,-,01:10
582,107.9,JPY,"Wednesday, February 7, 2018",108.1,d,Medium,JPY Leading Index CI (DEC P),108.2,d,05:00
583,120.7,JPY,"Wednesday, February 7, 2018",120.5,u,Medium,JPY Coincident Index (DEC P),117.9,-,05:00
584,A$65.3b,AUD,"Wednesday, February 7, 2018",,-,Low,AUD Foreign Reserves (Australian dollar) (JAN),A$85.4b,-,05:30
585,-0.6%,EUR,"Wednesday, February 7, 2018",-0.7%,u,Low,EUR German Industrial Production s.a. (MoM) (DEC),3.1%,d,07:00
586,6.5%,EUR,"Wednesday, February 7, 2018",6.8%,d,Medium,EUR German Industrial Production n.s.a. and w.d.a. (YoY) (DEC),5.5%,d,07:00
587,1.32,CHF,"Wednesday, February 7, 2018",,-,Medium,CHF UBS Real Estate Bubble Index (4Q),1.34,u,07:00
588,731.4b,CHF,"Wednesday, February 7, 2018",,-,Low,CHF Foreign Currency Reserves (JAN),744.2b,u,08:00
589,-0.6%,GBP,"Wednesday, February 7, 2018",0.2%,d,Low,GBP Halifax House Prices (MoM) (JAN),-0.8%,u,08:30
590,2.2%,GBP,"Wednesday, February 7, 2018",2.4%,d,Low,GBP Halifax House Price 3Mths/Year (JAN),2.7%,-,08:30
591,,EUR,"Wednesday, February 7, 2018",,-,Low,EUR ECB's Nouy and Lautenschlaeger Speak in Frankfurt,,-,09:00
592,,EUR,"Wednesday, February 7, 2018",,-,Low,EUR European Commission Economic Forecasts,,-,10:00
593,$3161.5b,CNY,"Wednesday, February 7, 2018",$3170.0b,d,Low,CNY Foreign Reserves (JAN),$3139.9b,-,10:20
594,,USD,"Wednesday, February 7, 2018",,-,Low,USD Fed's Kaplan Speaks in Frankfurt,,-,11:00
595,0.7%,USD,"Wednesday, February 7, 2018",,-,Medium,USD MBA Mortgage Applications (2 FEB),-2.6%,-,12:00
596,4.8%,CAD,"Wednesday, February 7, 2018",2.0%,u,Medium,CAD Building Permits (MoM) (DEC),-7.3%,u,13:30
597,,USD,"Wednesday, February 7, 2018",,-,Low,USD Fed's Dudley Speaks in Moderated Q&A,,-,13:30
598,,USD,"Wednesday, February 7, 2018",,-,Low,USD Fed's Evans Speaks on Economic and Policy Outlook,,-,15:15
599,3414k,USD,"Wednesday, February 7, 2018",500k,d,Low,USD DOE U.S. Gasoline Inventories (2 FEB),-1980k,-,15:30
600,1895k,USD,"Wednesday, February 7, 2018",3150k,u,Medium,USD DOE U.S. Crude Oil Inventories (2 FEB),6776k,-,15:30
601,-711k,USD,"Wednesday, February 7, 2018",,-,Low,USD DOE Cushing OK Crude Inventory (2 FEB),-2224k,-,15:30
602,3926k,USD,"Wednesday, February 7, 2018",-1250k,d,Low,USD DOE U.S. Distillate Inventory (2 FEB),-1940k,-,15:30
603,,USD,"Wednesday, February 7, 2018",,-,Low,USD U.S. to Sell USD24 Bln 10-Year Notes,,-,18:00
604,1.75%,NZD,"Wednesday, February 7, 2018",1.75%,-,High,NZD RBNZ Official Cash Rate (8 FEB),1.75%,-,20:00
605,$18.447b,USD,"Wednesday, February 7, 2018",$20.000b,d,Medium,USD Consumer Credit (DEC),$31.019b,u,20:00
606,,NZD,"Wednesday, February 7, 2018",,-,High,NZD RBNZ's Spencer news conference on policy statement,,-,21:00
607,,USD,"Wednesday, February 7, 2018",,-,High,USD Fed's Williams Speaks in Hawaii,,-,22:20
608,2.9%,JPY,"Wednesday, February 7, 2018",,-,Medium,JPY Housing Loans (YoY) (4Q),3.0%,u,23:50
609,¥797.2b,JPY,"Wednesday, February 7, 2018",¥1056.9b,d,Low,JPY BoP Current Account Balance (DEC),¥1347.3b,-,23:50
610,¥1479.6b,JPY,"Wednesday, February 7, 2018",¥1652.6b,d,Low,JPY Adjusted Current Account Total (Yen) (DEC),¥1700.5b,-,23:50
611,¥538.9b,JPY,"Wednesday, February 7, 2018",¥520.4b,u,Medium,JPY Trade Balance - BOP Basis (Yen) (DEC),¥181.0b,-,23:50
612,-¥866.6b,JPY,"Wednesday, February 7, 2018",,-,Low,JPY Japan Buying Foreign Bonds (Yen) (2 FEB),¥16.4b,d,23:50
613,¥466.5b,JPY,"Wednesday, February 7, 2018",,-,Low,JPY Japan Buying Foreign Stocks (Yen) (2 FEB),¥374.5b,-,23:50
614,-¥353.1b,JPY,"Wednesday, February 7, 2018",,-,Low,JPY Foreign Buying Japan Bonds (2 FEB),-¥253.8b,d,23:50
615,-¥126.7b,JPY,"Wednesday, February 7, 2018",,-,Low,JPY Foreign Buying Japan Stocks (2 FEB),-¥171.8b,u,23:50
616,2.4%,JPY,"Wednesday, February 7, 2018",,-,Medium,JPY Bank Lending incl Trusts (YoY) (JAN),2.5%,-,23:50
617,2.3%,JPY,"Wednesday, February 7, 2018",,-,Medium,JPY Bank Lending Ex-Trusts (YoY) (JAN),2.4%,-,23:50
618,,NZD,"Thursday, February 8, 2018",,-,High,NZD RBNZ's Spencer at Parliament Select Committee,,-,00:00
619,8.0%,GBP,"Thursday, February 8, 2018",5.0%,u,Medium,GBP RICS House Price Balance (JAN),8.0%,-,00:01
620,6,AUD,"Thursday, February 8, 2018",,-,Medium,AUD NAB Business Confidence (4Q),8,u,00:30
621,,JPY,"Thursday, February 8, 2018",,-,Low,JPY BOJ Suzuki makes a speech in Wakayama,,-,01:30
622,3.07,JPY,"Thursday, February 8, 2018",,-,Low,JPY Tokyo Avg Office Vacancies (JAN),3.12,-,02:00
623,6.0%,CNY,"Thursday, February 8, 2018",2.6%,u,Low,CNY Exports (YoY) CNY (JAN),7.4%,-,03:06
624,30.2%,CNY,"Thursday, February 8, 2018",5.3%,u,Low,CNY Imports (YoY) CNY (JAN),0.9%,-,03:06
625,135.80b,CNY,"Thursday, February 8, 2018",330.00b,d,Medium,CNY Trade Balance CNY (JAN),361.98b,-,03:06
626,$20.34b,CNY,"Thursday, February 8, 2018",$54.65b,d,Medium,CNY Trade Balance (JAN),$54.69b,-,03:41
627,36.9%,CNY,"Thursday, February 8, 2018",10.6%,u,Low,CNY Imports (YoY) (JAN),4.5%,-,03:41
628,11.1%,CNY,"Thursday, February 8, 2018",10.7%,u,Low,CNY Exports (YoY) (JAN),10.9%,-,03:41
629,4.95%,JPY,"Thursday, February 8, 2018",,-,Medium,JPY Bankruptcies (YoY) (JAN),-1.97%,-,04:30
630,49.9,JPY,"Thursday, February 8, 2018",53.7,d,Medium,JPY Eco Watchers Survey Current (JAN),53.9,-,05:00
631,52.4,JPY,"Thursday, February 8, 2018",53.6,d,Medium,JPY Eco Watchers Survey Outlook SA (JAN),52.7,-,05:00
632,18.2b,EUR,"Thursday, February 8, 2018",21.0b,d,Medium,EUR German Trade Balance (DEC),23.7b,-,07:00
633,27.8b,EUR,"Thursday, February 8, 2018",28.0b,d,Low,EUR German Current Account (euros) (DEC),25.4b,-,07:00
634,0.3%,EUR,"Thursday, February 8, 2018",-1.0%,u,Low,EUR German Exports s.a. (MoM) (DEC),4.1%,-,07:00
635,1.4%,EUR,"Thursday, February 8, 2018",-0.8%,-,Low,EUR German Imports s.a. (MoM) (DEC),2.3%,-,07:00
636,$62.2b,CNY,"Thursday, February 8, 2018",,-,Low,CNY BoP Current Account Balance (4Q P),$40.5b,-,07:17
637,,EUR,"Thursday, February 8, 2018",,-,Medium,EUR ECB Publishes Economic Bulletin,,-,09:00
638,,AUD,"Thursday, February 8, 2018",,-,High,AUD RBA Governor Lowe Gives Speech in Sydney,,-,09:00
639,,EUR,"Thursday, February 8, 2018",,-,Low,EUR ECB's Mersch Speaks in London,,-,10:30
640,,EUR,"Thursday, February 8, 2018",,-,Low,EUR ECB's Praet Speaks in Frankfurt,,-,10:45
641,0.50%,GBP,"Thursday, February 8, 2018",0.50%,-,High,GBP Bank of England Bank Rate (8 FEB),0.50%,-,12:00
642,435b,GBP,"Thursday, February 8, 2018",435b,-,High,GBP BOE Asset Purchase Target (FEB),435b,-,12:00
643,10b,GBP,"Thursday, February 8, 2018",10b,-,Low,GBP BOE Corporate Bond Target (FEB),10b,-,12:00
644,,GBP,"Thursday, February 8, 2018",,-,High,GBP Bank of England Inflation Report,,-,12:00
645,,USD,"Thursday, February 8, 2018",,-,Low,USD Fed's Harker Speaks on Economy: Outlook and Impact for College,,-,13:00
646,216.2k,CAD,"Thursday, February 8, 2018",210.0k,u,Medium,CAD Housing Starts (JAN),216.3k,d,13:15
647,0.0%,CAD,"Thursday, February 8, 2018",0.1%,d,Low,CAD New Housing Price Index (MoM) (DEC),0.1%,-,13:30
648,3.3%,CAD,"Thursday, February 8, 2018",,-,Medium,CAD New Housing Price Index (YoY) (DEC),3.4%,-,13:30
649,221k,USD,"Thursday, February 8, 2018",232k,u,Medium,USD Initial Jobless Claims (3 FEB),230k,-,13:30
650,1923k,USD,"Thursday, February 8, 2018",1940k,u,Medium,USD Continuing Claims (27 JAN),1956k,d,13:30
651,,USD,"Thursday, February 8, 2018",,-,Low,USD Fed's Kashkari Speaks in Moderated Q&A,,-,14:00
652,1.19%,USD,"Thursday, February 8, 2018",,-,Low,USD MBA Mortgage Foreclosures (4Q),1.23%,-,15:00
653,5.17%,USD,"Thursday, February 8, 2018",,-,Low,USD Mortgage Delinquencies (4Q),4.88%,-,15:00
654,-119,USD,"Thursday, February 8, 2018",-115,u,Low,USD EIA Working Natural Gas Implied Flow (2 FEB),-99,-,15:30
655,-119,USD,"Thursday, February 8, 2018",-115,u,Low,USD EIA Natural Gas Storage Change (2 FEB),-99,-,15:30
656,6.4%,NZD,"Thursday, February 8, 2018",,-,Low,NZD QV House Prices (YoY) (JAN),6.6%,-,16:00
657,,CAD,"Thursday, February 8, 2018",,-,Low,CAD Bank of Canada Senior Deputy Governor Carolyn Wilkins Speech,,-,17:45
658,,USD,"Thursday, February 8, 2018",,-,Low,USD U.S. to Sell USD16 Bln 30-Year Bonds,,-,18:00
659,7.50%,MXN,"Thursday, February 8, 2018",7.50%,-,High,MXN Overnight Rate (FEB 08),7.25%,-,19:00
660,4.1%,NZD,"Thursday, February 8, 2018",,-,Low,NZD ANZ Truckometer Heavy (MoM) (JAN),-4.4%,d,21:00
661,3.4%,JPY,"Thursday, February 8, 2018",3.6%,d,Low,JPY Japan Money Stock M2+CD (YoY) (JAN),3.6%,-,23:50
662,2.9%,JPY,"Thursday, February 8, 2018",3.1%,d,Low,JPY Japan Money Stock M3 (YoY) (JAN),3.1%,-,23:50
663,,CNY,"Friday, February 9, 2018",,-,Medium,CNY Foreign Direct Investment (YoY) (JAN),-9.2%,-,
664,-2.3%,AUD,"Friday, February 9, 2018",-1.0%,d,Medium,AUD Home Loans (MoM) (DEC),2.1%,-,00:30
665,-2.6%,AUD,"Friday, February 9, 2018",,-,Low,AUD Investment Lending (DEC),1.5%,-,00:30
666,-1.0%,AUD,"Friday, February 9, 2018",,-,Low,AUD Value of Loans (MoM) (DEC),2.7%,-,00:30
667,,AUD,"Friday, February 9, 2018",,-,Medium,AUD RBA Quarterly Statement on Monetary Policy,,-,00:30
668,,JPY,"Friday, February 9, 2018",,-,Low,JPY BOJ Outright Bond Purchase 3~5 Years,,-,01:10
669,,JPY,"Friday, February 9, 2018",,-,Low,JPY BOJ Outright Bond Purchase 1~3 Years,,-,01:10
670,,JPY,"Friday, February 9, 2018",,-,Low,JPY BOJ Outright Bond Purchase 25 Years~,,-,01:10
671,,JPY,"Friday, February 9, 2018",,-,Low,JPY BOJ Outright Bond Purchase 10~25 Years,,-,01:10
672,4.3%,CNY,"Friday, February 9, 2018",4.2%,u,Medium,CNY Producer Price Index (YoY) (JAN),4.9%,-,01:30
673,1.5%,CNY,"Friday, February 9, 2018",1.5%,-,High,CNY Consumer Price Index (YoY) (JAN),1.8%,-,01:30
674,,USD,"Friday, February 9, 2018",,-,Low,USD Fed's George Speaks on the Economy,,-,02:00
675,-0.2%,JPY,"Friday, February 9, 2018",0.1%,d,Medium,JPY Tertiary Industry Index (MoM) (DEC),1.1%,-,04:30
676,3.3%,CHF,"Friday, February 9, 2018",3.4%,u,Medium,CHF Unemployment Rate (JAN),3.3%,-,06:45
677,3.0%,CHF,"Friday, February 9, 2018",3.0%,-,Medium,CHF Unemployment Rate s.a. (JAN),3.0%,-,06:45
678,-0.2%,GBP,"Friday, February 9, 2018",-0.9%,u,Low,GBP Industrial Production (MoM) (DEC),0.3%,-,09:30
679,0.0%,GBP,"Friday, February 9, 2018",0.4%,d,Medium,GBP Industrial Production (YoY) (DEC),2.6%,u,09:30
680,0.3%,GBP,"Friday, February 9, 2018",0.3%,-,Low,GBP Manufacturing Production (MoM) (DEC),0.2%,u,09:30
681,1.4%,GBP,"Friday, February 9, 2018",1.2%,u,Medium,GBP Manufacturing Production (YoY) (DEC),3.8%,u,09:30
682,1.6%,GBP,"Friday, February 9, 2018",-0.1%,u,Low,GBP Construction Output SA (MoM) (DEC),0.1%,u,09:30
683,-0.2%,GBP,"Friday, February 9, 2018",-1.9%,u,Medium,GBP Construction Output SA (YoY) (DEC),0.8%,u,09:30
684,-£13580,GBP,"Friday, February 9, 2018",-£11550,d,Medium,GBP Visible Trade Balance (Pounds) (DEC),-£12460,u,09:30
685,-£5180,GBP,"Friday, February 9, 2018",-£4050,d,Medium,GBP Trade Balance Non EU GBP/Mn (DEC),-£4510,u,09:30
686,-£4896,GBP,"Friday, February 9, 2018",-£2400,d,Medium,GBP Trade Balance (DEC),-£3652,u,09:30
687,0.5%,GBP,"Friday, February 9, 2018",0.5%,-,Medium,GBP NIESR Gross Domestic Product Estimate (JAN),0.6%,-,12:00
688,-88.0k,CAD,"Friday, February 9, 2018",10.0k,d,High,CAD Net Change in Employment (JAN),64.8k,d,13:30
689,5.9%,CAD,"Friday, February 9, 2018",5.8%,d,High,CAD Unemployment Rate (JAN),5.8%,d,13:30
690,49,CAD,"Friday, February 9, 2018",,-,Medium,CAD Full Time Employment Change (JAN),23.2,d,13:30
691,-137,CAD,"Friday, February 9, 2018",,-,Low,CAD Part Time Employment Change (JAN),41.6,d,13:30
692,65.5,CAD,"Friday, February 9, 2018",,-,Low,CAD Participation Rate (JAN),65.8,-,13:30
693,0.4%,USD,"Friday, February 9, 2018",0.2%,u,Low,USD Wholesale Inventories (MoM) (DEC F),0.2%,-,15:00
694,1.2%,USD,"Friday, February 9, 2018",0.4%,u,Low,USD Wholesale Trade Sales (MoM) (DEC),1.9%,u,15:00
695,,GBP,"Friday, February 9, 2018",,-,Low,GBP BOE's Cunliffe Speaks in California,,-,16:45
696,975,USD,"Friday, February 9, 2018",,-,Medium,USD Baker Hughes U.S. Rig Count (9 FEB),946,-,18:00
697,8.6%,CNY,"Saturday, February 10, 2018",8.2%,u,Low,CNY Money Supply M2 (YoY) (JAN),8.2%,-,09:01
698,,JPY,"Monday, January 29, 2018",,-,Low,JPY BOJ Outright Bond Purchase 5~10 Years,,-,01:10
699,0.3%,EUR,"Monday, January 29, 2018",0.2%,u,Low,EUR German Import Price Index (MoM) (DEC),0.8%,-,07:00
700,1.1%,EUR,"Monday, January 29, 2018",1.1%,-,Low,EUR German Import Price Index (YoY) (DEC),2.7%,-,07:00
701,575b,CHF,"Monday, January 29, 2018",,-,Low,CHF Total Sight Deposits CHF (JAN 26),574.7b,-,09:00
702,465.1b,CHF,"Monday, January 29, 2018",,-,Low,CHF Domestic Sight Deposits CHF (JAN 26),468.9b,-,09:00
703,,EUR,"Monday, January 29, 2018",,-,Low,EUR ECB's Lautenschlaeger Speaks in Frankfurt,,-,10:45
704,0.4%,USD,"Monday, January 29, 2018",0.3%,u,Medium,USD Personal Income (DEC),0.3%,-,13:30
705,0.4%,USD,"Monday, January 29, 2018",0.4%,-,Medium,USD Personal Spending (DEC),0.8%,u,13:30
706,0.3%,USD,"Monday, January 29, 2018",0.4%,d,Medium,USD Real Personal Spending (DEC),0.5%,u,13:30
707,0.1%,USD,"Monday, January 29, 2018",0.1%,-,Low,USD PCE Deflator (MoM) (DEC),0.2%,-,13:30
708,1.7%,USD,"Monday, January 29, 2018",1.7%,-,Low,USD Personal Consumption Expenditure Deflator (YoY) (DEC),1.8%,-,13:30
709,0.2%,USD,"Monday, January 29, 2018",0.2%,-,Medium,USD PCE Core (MoM) (DEC),0.1%,-,13:30
710,1.5%,USD,"Monday, January 29, 2018",1.5%,-,High,USD PCE Core (YoY) (DEC),1.5%,-,13:30
711,33.4,USD,"Monday, January 29, 2018",25.4,u,Medium,USD Dallas Fed Manufacturing Activity (JAN),29.7,-,15:30
712,,EUR,"Monday, January 29, 2018",,-,Low,EUR ECB's Coeure Speaks in Paris,,-,16:00
713,,USD,"Monday, January 29, 2018",,-,Low,USD U.S. to Sell USD48 Bln 3-Month Bills,,-,16:30
714,,USD,"Monday, January 29, 2018",,-,Low,USD U.S. to Sell USD42 Bln 6-Month Bills,,-,16:30
715,640m,NZD,"Monday, January 29, 2018",-125m,u,Medium,NZD Trade Balance (DEC),-1233m,d,21:45
716,5.55b,NZD,"Monday, January 29, 2018",5.00b,u,Low,NZD Exports (DEC),4.61b,d,21:45
717,4.91b,NZD,"Monday, January 29, 2018",5.10b,d,Low,NZD Imports (DEC),5.84b,u,21:45
718,-2837m,NZD,"Monday, January 29, 2018",-3420m,u,Medium,NZD Trade Balance 12 Mth YTD (DEC),-3478m,d,21:45
719,120.9,AUD,"Monday, January 29, 2018",,-,Low,AUD ANZ Roy Morgan Weekly Consumer Confidence Index (JAN 28),119.4,-,22:30
720,2.8%,JPY,"Monday, January 29, 2018",2.7%,d,Medium,JPY Jobless Rate (DEC),2.7%,-,23:30
721,1.59,JPY,"Monday, January 29, 2018",1.57,u,Low,JPY Job-To-Applicant Ratio (DEC),1.56,-,23:30
722,-0.1%,JPY,"Monday, January 29, 2018",1.3%,d,Medium,JPY Overall Household Spending (YoY) (DEC),1.7%,-,23:30
723,0.9%,JPY,"Monday, January 29, 2018",-0.4%,u,Low,JPY Retail Trade s.a. (MoM) (DEC),1.8%,d,23:50
724,3.6%,JPY,"Monday, January 29, 2018",2.2%,u,Medium,JPY Retail Trade (YoY) (DEC),2.1%,d,23:50
725,1.1%,JPY,"Monday, January 29, 2018",0.5%,u,Medium,JPY Large Retailers' Sales (DEC),1.4%,-,23:50
726,13,AUD,"Tuesday, January 30, 2018",,-,Low,AUD NAB Business Conditions (DEC),13,u,00:30
727,11,AUD,"Tuesday, January 30, 2018",,-,Medium,AUD NAB Business Confidence (DEC),7,u,00:30
728,0.6%,EUR,"Tuesday, January 30, 2018",0.6%,-,Low,EUR French Gross Domestic Product (QoQ) (4Q A),0.5%,d,06:30
729,2.4%,EUR,"Tuesday, January 30, 2018",2.3%,u,Medium,EUR French Gross Domestic Product (YoY) (4Q A),2.3%,-,06:30
730,2.8%,CHF,"Tuesday, January 30, 2018",,-,Low,CHF Exports (MoM) (DEC),0.4%,d,07:00
731,0.6%,CHF,"Tuesday, January 30, 2018",,-,Low,CHF Imports (MoM) (DEC),3.7%,u,07:00
732,0.7%,CHF,"Tuesday, January 30, 2018",,-,Low,CHF Swiss Watch Exports (YoY) (DEC),6.3%,-,07:00
733,106.9,CHF,"Tuesday, January 30, 2018",110.8,d,Medium,CHF KOF Leading Indicator (JAN),111.4,u,08:00
734,1.5b,GBP,"Tuesday, January 30, 2018",1.4b,u,Medium,GBP Net Consumer Credit (DEC),1.5b,u,09:30
735,3.7b,GBP,"Tuesday, January 30, 2018",3.4b,u,Medium,GBP Net Lending Sec. on Dwellings (DEC),3.7b,u,09:30
736,61.0k,GBP,"Tuesday, January 30, 2018",63.5k,d,Medium,GBP Mortgage Approvals (DEC),64.7k,u,09:30
737,-0.6%,GBP,"Tuesday, January 30, 2018",,-,Low,GBP Money Supply M4 (MoM) (DEC),0.2%,-,09:30
738,3.7%,GBP,"Tuesday, January 30, 2018",,-,Low,GBP M4 Money Supply (YoY) (DEC),3.8%,u,09:30
739,4.7%,GBP,"Tuesday, January 30, 2018",,-,Low,GBP M4 Ex IOFCs 3M Annualised (DEC),3.6%,d,09:30
740,114.7,EUR,"Tuesday, January 30, 2018",116.2,d,Low,EUR Euro-Zone Economic Confidence (JAN),115.3,u,10:00
741,1.54,EUR,"Tuesday, January 30, 2018",1.68,d,Low,EUR Euro-Zone Business Climate Indicator (JAN),1.60,u,10:00
742,8.8,EUR,"Tuesday, January 30, 2018",8.9,d,Low,EUR Euro-Zone Industrial Confidence (JAN),8.8,d,10:00
743,16.7,EUR,"Tuesday, January 30, 2018",18.5,d,Low,EUR Euro-Zone Services Confidence (JAN),18.0,d,10:00
