,actual,country,date,forecast,forecast_error,impact,new,previous,previous_error,time
1679,0.3%,EUR,"Thursday, September 15, 2011",,d,Low,EUR Euro-Zone Employment (QoQ) (2Q),0.1%,u,09:00
1680,2.5%,EUR,"Thursday, September 15, 2011",,-,Low,EUR Euro-Zone Employment (YoY) (2Q),0.1%,-,09:00
1681,1663M,EUR,"Thursday, September 15, 2011",,-,Low,EUR Italian Current Account (euros) (JUL),-4252M,-,09:00
1682,11.1%,CNY,"Thursday, September 15, 2011",,-,Medium,CNY Actual FDI (AUG),19.8%,-,10:40
1683,2.7%,CAD,"Thursday, September 15, 2011",1.4%,-,Low,CAD Manufacturing Shipments (MoM) (JUL),-1.5%,-,12:30
1684,0.4%,USD,"Thursday, September 15, 2011",0.2%,-,Medium,USD Consumer Price Index (MoM) (AUG),0.5%,-,12:30
1685,0.2%,USD,"Thursday, September 15, 2011",0.2%,-,Medium,USD Consumer Price Index Ex Food & Energy (MoM) (AUG),0.2%,-,12:30
1686,-$118.0B,USD,"Thursday, September 15, 2011",-$122.9B,-,Low,USD Current Account Balance (2Q),-$119.3B,-,12:30
1687,3.8%,USD,"Thursday, September 15, 2011",3.6%,-,High,USD Consumer Price Index (YoY) (AUG),3.6%,-,12:30
1688,2.0%,USD,"Thursday, September 15, 2011",1.9%,-,High,USD Consumer Price Index Ex Food & Energy (YoY) (AUG),1.8%,-,12:30
1689,226.014,USD,"Thursday, September 15, 2011",,-,Medium,USD Consumer Price Index Core Index s.a. (AUG),225.463,-,12:30
1690,226.545,USD,"Thursday, September 15, 2011",226.243,-,Medium,USD Consumer Price Index n.s.a. (AUG),225.922,-,12:30
1691,-8.82,USD,"Thursday, September 15, 2011",-4.00,-,Low,USD Empire Manufacturing (SEP),-7.72,-,12:30
1692,428K,USD,"Thursday, September 15, 2011",411K,-,Low,USD Initial Jobless Claims (SEP 9),414K,-,12:30
1693,3726K,USD,"Thursday, September 15, 2011",3710K,-,Low,USD Continuing Claims (SEP 3),3717K,-,12:30
1694,0.2%,USD,"Thursday, September 15, 2011",0.0%,-,Medium,USD Industrial Production (AUG),0.9%,-,13:15
1695,77.4%,USD,"Thursday, September 15, 2011",77.5%,-,Low,USD Capacity Utilization (AUG),77.5%,-,13:15
1696,-49,USD,"Thursday, September 15, 2011",-49.3,-,Low,USD Bloomberg Consumer Comfort (SEP 11),-49.3,-,13:45
1697,-17.5,USD,"Thursday, September 15, 2011",-15.0,-,Medium,USD Philadelphia Fed. (SEP),-30.7,-,14:00
1698,87,USD,"Thursday, September 15, 2011",82,-,Low,USD EIA Natural Gas Storage Change (SEP 9),64,-,14:30
1699,8.1%,AUD,"Wednesday, September 14, 2011",,-,Medium,AUD Westpac Consumer Confidence (SEP),-3.5%,-,00:30
1700,96.9,AUD,"Wednesday, September 14, 2011",,-,Low,AUD Westpac Consumer Confidence Index (SEP),89.6,-,00:30
1701,-4.7%,AUD,"Wednesday, September 14, 2011",2.0%,d,Medium,AUD Dwelling Starts (Q2),3.3%,u,01:30
1702,62.5%,NZD,"Wednesday, September 14, 2011",,-,Low,NZD Non Resident Bond Holdings (AUG),60.1%,-,03:00
1703,1.7%,JPY,"Wednesday, September 14, 2011",,-,Low,JPY Tokyo Condominium Sales (YoY) (AUG),-1.3%,-,04:00
1704,0.4%,JPY,"Wednesday, September 14, 2011",,-,Low,JPY Industrial Production (MoM) (JUL F),0.6%,-,04:30
1705,-3.0%,JPY,"Wednesday, September 14, 2011",,-,Medium,JPY Industrial Production (YoY) (JUL F),-2.8%,-,04:30
1706,0.6%,JPY,"Wednesday, September 14, 2011",,-,Low,JPY Capacity Utilization (MoM) (JUL),5.2%,-,04:30
1707,15.2%,JPY,"Wednesday, September 14, 2011",,-,Medium,JPY Machine Tool Orders (YoY) (AUG F),15.3%,-,06:00
1708,-1.2%,CHF,"Wednesday, September 14, 2011",-0.4%,d,Low,CHF Producer & Import Prices (MoM) (AUG),-0.7%,-,07:15
1709,-1.9%,CHF,"Wednesday, September 14, 2011",-1.1%,d,Low,CHF Producer & Import Prices (YoY) (AUG),-0.6%,-,07:15
1710,4.9%,GBP,"Wednesday, September 14, 2011",5.0%,u,Medium,GBP Claimant Count Rate (AUG),4.9%,-,08:30
1711,20.3K,GBP,"Wednesday, September 14, 2011",35.0K,u,High,GBP Jobless Claims Change (AUG),33.7K,u,08:30
1712,2.8%,GBP,"Wednesday, September 14, 2011",2.7%,u,Medium,GBP Average Weekly Earnings (3M/YoY) (JUL),2.7%,u,08:30
1713,2.1%,GBP,"Wednesday, September 14, 2011",2.1%,-,Low,GBP Weekly Earnings exBonus (3M/YoY) (JUL),2.3%,u,08:30
1714,7.9%,GBP,"Wednesday, September 14, 2011",7.9%,-,Medium,GBP ILO Unemployment Rate (3M) (JUL),7.9%,-,08:30
1715,4.2%,EUR,"Wednesday, September 14, 2011",4.6%,d,Medium,EUR Euro-Zone Industrial Production w.d.a. (YoY) (JUL),2.6%,d,09:00
1716,1.0%,EUR,"Wednesday, September 14, 2011",1.5%,d,Low,EUR Euro-Zone Industrial Production s.a. (MoM) (JUL),-0.8%,d,09:00
1717,6.3%,USD,"Wednesday, September 14, 2011",,-,Low,USD MBA Mortgage Applications (SEP 9),-4.9%,-,11:00
1718,78.4%,CAD,"Wednesday, September 14, 2011",78.0%,-,Low,CAD Capacity Utilization Rate (2Q),79.0%,-,12:30
1719,0.0%,USD,"Wednesday, September 14, 2011",0.0%,-,Low,USD Producer Price Index (MoM) (AUG),0.2%,-,12:30
1720,0.1%,USD,"Wednesday, September 14, 2011",0.2%,-,Low,USD Producer Price Index Ex Food & Energy (MoM) (AUG),0.4%,-,12:30
1721,6.5%,USD,"Wednesday, September 14, 2011",6.5%,-,Medium,USD Producer Price Index (YoY) (AUG),7.2%,-,12:30
1722,2.5%,USD,"Wednesday, September 14, 2011",2.6%,-,Medium,USD Producer Price Index Ex Food & Energy (YoY) (AUG),2.5%,-,12:30
1723,0.0%,USD,"Wednesday, September 14, 2011",0.2%,-,High,USD Advance Retail Sales (AUG),0.5%,-,12:30
1724,0.1%,USD,"Wednesday, September 14, 2011",0.2%,-,Medium,USD Retail Sales Less Autos (AUG),0.5%,-,12:30
1725,0.4%,USD,"Wednesday, September 14, 2011",0.5%,-,Medium,USD Business Inventories (JUL),0.3%,-,14:00
1726,-6704K,USD,"Wednesday, September 14, 2011",-3000K,-,Low,USD DOE U.S. Crude Oil Inventories (SEP 9),-3963K,-,14:30
1727,-460K,USD,"Wednesday, September 14, 2011",,-,Low,USD DOE Cushing OK Crude Inventory (SEP 9),-396K,-,14:30
1728,1711K,USD,"Wednesday, September 14, 2011",700K,-,Low,USD DOE U.S. Distillate Inventory (SEP 9),709K,-,14:30
1729,1940K,USD,"Wednesday, September 14, 2011",-500K,-,Low,USD DOE U.S. Gasoline Inventories (SEP 9),199K,-,14:30
1730,2.50%,NZD,"Wednesday, September 14, 2011",2.50%,-,High,NZD Reserve Bank of New Zealand Rate Decision (SEP 15),2.50%,-,21:00
1731,52.9,NZD,"Wednesday, September 14, 2011",,-,Medium,NZD Business NZ Performance of Manufacturing Index (AUG),53.2,-,22:30
1732,0.1%,NZD,"Tuesday, September 13, 2011",,-,Low,NZD QV House Prices (YoY) (AUG),-0.4%,-,00:00
1733,3223.7,NZD,"Tuesday, September 13, 2011",,-,Low,NZD REINZ Housing Price Index (AUG),3208.7,-,00:00
1734,21.1%,NZD,"Tuesday, September 13, 2011",,-,Low,NZD REINZ House Sales (YoY) (AUG),11.7%,-,00:00
1735,0.5%,NZD,"Tuesday, September 13, 2011",,-,Low,NZD REINZ Housing Price Index (MoM) (AUG),-0.6%,-,00:00
1736,10%,JPY,"Tuesday, September 13, 2011",,-,Low,JPY Japan Manpower Survey (4Q),8%,-,01:00
1737,-8,AUD,"Tuesday, September 13, 2011",,-,Medium,AUD NAB Business Confidence (AUG),2,-,01:30
1738,-3,AUD,"Tuesday, September 13, 2011",,-,Low,AUD NAB Business Conditions (AUG),-1,-,01:30
1739,0.6%,EUR,"Tuesday, September 13, 2011",0.3%,u,Low,EUR French Consumer Price Index - EU Harmonised (MoM) (AUG),-0.5%,-,05:30
1740,2.4%,EUR,"Tuesday, September 13, 2011",2.2%,u,Low,EUR French Consumer Price Index - EU Harmonised (YoY) (AUG),2.1%,-,05:30
1741,0.5%,EUR,"Tuesday, September 13, 2011",0.3%,u,Low,EUR French Consumer Price Index (MoM) (AUG),-0.4%,-,05:30
1742,2.2%,EUR,"Tuesday, September 13, 2011",2.0%,u,Low,EUR French Consumer Price Index (YoY) (AUG),1.9%,-,05:30
1743,122.59,EUR,"Tuesday, September 13, 2011",,-,Low,EUR French Consumer Price Index Ex Tobacco Index (AUG),121.94,-,05:30
1744,-4.5B,EUR,"Tuesday, September 13, 2011",,-,Low,EUR French Current Account (euros) (JUL),-3.4B,-,06:45
1745,-8922,GBP,"Tuesday, September 13, 2011",-8500,d,Medium,GBP Visible Trade Balance GBP Millions (JUL),-8873,-,08:30
1746,-5505,GBP,"Tuesday, September 13, 2011",-5450,d,Medium,GBP Visible Trade Balance Non EU GBP Millions (JUL),-5718,-,08:30
1747,-4450,GBP,"Tuesday, September 13, 2011",-4200,d,Medium,GBP Visible Trade Balance Total GBP Millions (JUL),-4496,-,08:30
1748,-1.5%,GBP,"Tuesday, September 13, 2011",-1.2%,d,Low,GBP DCLG UK House Prices (YoY) (JUL),-2.0%,-,08:30
1749,0.6%,GBP,"Tuesday, September 13, 2011",0.6%,-,Medium,GBP Consumer Price Index (MoM) (AUG),0.0%,-,08:30
1750,4.5%,GBP,"Tuesday, September 13, 2011",4.5%,-,High,GBP Consumer Price Index (YoY) (AUG),4.4%,-,08:30
1751,3.1%,GBP,"Tuesday, September 13, 2011",3.0%,u,High,GBP Core Consumer Price Index (YoY) (AUG),3.1%,-,08:30
1752,236.1,GBP,"Tuesday, September 13, 2011",235.9,u,Low,GBP Retail Price Index (AUG),234.7,-,08:30
1753,0.6%,GBP,"Tuesday, September 13, 2011",0.6%,-,Low,GBP Retail Price Index (MoM) (AUG),-0.2%,-,08:30
1754,5.2%,GBP,"Tuesday, September 13, 2011",5.1%,u,Low,GBP Retail Price Index (YoY) (AUG),5.0%,-,08:30
1755,5.3%,GBP,"Tuesday, September 13, 2011",5.2%,u,Low,GBP Retail Price Index Ex Mort Int.Payments (YoY) (AUG),5.0%,-,08:30
1756,88.1,USD,"Tuesday, September 13, 2011",88.0,u,Low,USD NFIB Small Business Optimism (AUG),89.9,-,11:30
1757,-0.4%,USD,"Tuesday, September 13, 2011",-0.8%,u,Low,USD Import Price Index (MoM) (AUG),0.3%,-,12:30
1758,13.0%,USD,"Tuesday, September 13, 2011",12.5%,u,Low,USD Import Price Index (YoY) (AUG),13.8%,d,12:30
1759,39.9,USD,"Tuesday, September 13, 2011",38.0,u,Low,USD IBD/TIPP Economic Optimism (SEP),35.8,-,14:00
1760,-$134.2B,USD,"Tuesday, September 13, 2011",-$132.0B,d,Medium,USD Monthly Budget Statement (AUG),-$90.5B,-,18:00
1761,,JPY,"Monday, September 12, 2011",,-,Low,JPY Nationwide Department Store Sales (YoY) (AUG),-0.1%,-,
1762,,JPY,"Monday, September 12, 2011",,-,Low,JPY Tokyo Department Store Sales (YoY) (AUG),-1.3%,-,
1763,1826M,AUD,"Monday, September 12, 2011",1900M,d,Medium,AUD Trade Balance (Australian dollar) (JUL),1817M,d,01:30
1764,-0.7%,EUR,"Monday, September 12, 2011",0.1%,d,Low,EUR Italian Industrial Production s.a. (MoM) (JUL),-0.8%,d,08:00
1765,-1.6%,EUR,"Monday, September 12, 2011",0.2%,d,Low,EUR Italian Industrial Production w.d.a. (YoY) (JUL),0.1%,d,08:00
1766,-4.6%,EUR,"Monday, September 12, 2011",1.0%,d,Low,EUR Italian Industrial Production n.s.a. (YoY) (JUL),0.1%,d,08:00
1767,,USD,"Monday, September 12, 2011",,-,Low,USD Fed's Fisher Speaks on Monetary Policy in Dallas,,-,20:00
1768,,EUR,"Monday, September 12, 2011",,-,Low,EUR Germany Fourth Quarter Manpower Employment Outlook,,-,22:01
1769,2.1%,NZD,"Monday, September 12, 2011",,-,Medium,NZD Manufacturing Activity (Q2),2.7%,d,22:45
1770,-0.7%,NZD,"Monday, September 12, 2011",1.0%,d,Medium,NZD Manufacturing Activity Volume SA QoQ (Q2),1.4%,d,22:45
1771,-1.3%,NZD,"Monday, September 12, 2011",,-,Low,NZD Food Prices (MoM) (AUG),2.0%,-,22:45
1772,-23.0%,GBP,"Monday, September 12, 2011",-23.0%,-,Medium,GBP RICS House Price Balance (AUG),-22.0%,-,23:01
1773,16%,AUD,"Monday, September 12, 2011",,-,Low,AUD Australia Manpower Survey (4Q),17%,-,23:01
1774,23%,NZD,"Monday, September 12, 2011",,-,Low,NZD New Zealand Manpower Survey (4Q),17%,-,23:01
1775,548.5B,CNY,"Sunday, September 11, 2011",500.0B,u,High,CNY New Yuan Loans (AUG),492.6B,-,02:00
1776,14.7%,CNY,"Sunday, September 11, 2011",,-,Low,CNY Money Supply - M0 (YoY) (AUG),14.3%,-,02:00
1777,11.2%,CNY,"Sunday, September 11, 2011",12.0%,d,Low,CNY Money Supply - M1 (YoY) (AUG),11.6%,-,02:00
1778,13.5%,CNY,"Sunday, September 11, 2011",14.2%,d,Low,CNY Money Supply - M2 (YoY) (AUG),14.7%,-,02:00
1779,,JPY,"Sunday, September 11, 2011",,-,High,JPY BOJ to Publish Minutes of Aug. 4-5 Board Meeting,,-,23:50
1780,6.6,JPY,"Sunday, September 11, 2011",,u,Medium,JPY BSI Large All Industry (QoQ) (3Q),-22,-,23:50
1781,10.3,JPY,"Sunday, September 11, 2011",,u,Medium,JPY BSI Large Manufacturing (QoQ) (3Q),-23.3,-,23:50
1782,-0.1%,JPY,"Sunday, September 11, 2011",0.2%,d,Medium,JPY Tertiary Industry Index (MoM) (JUL),1.8%,d,23:50
1783,-0.2%,JPY,"Sunday, September 11, 2011",-0.2%,-,Low,JPY Domestic Corporate Goods Price Index (MoM) (AUG),0.3%,u,23:50
1784,2.6%,JPY,"Sunday, September 11, 2011",2.7%,d,Low,JPY Domestic Corporate Goods Price Index (YoY) (AUG),2.9%,-,23:50
1785,-9.7K,AUD,"Thursday, September 8, 2011",10.0K,d,High,AUD Employment Change (AUG),-4.1K,d,01:30
1786,5.3%,AUD,"Thursday, September 8, 2011",5.1%,d,High,AUD Unemployment Rate (AUG),5.1%,-,01:30
1787,-12.6K,AUD,"Thursday, September 8, 2011",,-,Medium,AUD Full Time Employment Change (AUG),-26.4K,d,01:30
1788,2.9K,AUD,"Thursday, September 8, 2011",,-,Medium,AUD Part Time Employment Change (AUG),22.3K,u,01:30
1789,65.6%,AUD,"Thursday, September 8, 2011",65.6%,-,Low,AUD Participation Rate (AUG),65.6%,-,01:30
1790,8.65,Tokyo,"Thursday, September 8, 2011",,-,Low,Tokyo Average Office Vacancies (%) (AUG),8.76,-,02:22
1791,-3.6%,JPY,"Thursday, September 8, 2011",,-,Medium,JPY Bankruptcies (YoY) (AUG),1.4%,-,04:30
1792,47.3,JPY,"Thursday, September 8, 2011",,-,Medium,JPY Eco Watchers Survey: Current (AUG),52.6,-,05:00
1793,47.1,JPY,"Thursday, September 8, 2011",,-,Medium,JPY Eco Watchers Survey: Outlook (AUG),48.5,-,05:00
1794,0.2%,EUR,"Thursday, September 8, 2011",0.4%,d,Low,EUR French Non-Farm Payrolls (QoQ) (2Q F),0.5%,u,05:30
1795,2.8%,CHF,"Thursday, September 8, 2011",2.8%,-,Medium,CHF Unemployment Rate (AUG),2.8%,-,05:45
1796,3.0%,CHF,"Thursday, September 8, 2011",3.0%,-,Medium,CHF Unemployment Rate s.a. (AUG),3.0%,-,05:45
1797,-1.8%,EUR,"Thursday, September 8, 2011",0.5%,d,Low,EUR German Exports s.a. (MoM) (JUL),-1.2%,-,06:00
1798,-0.3%,EUR,"Thursday, September 8, 2011",0.3%,u,Low,EUR German Imports s.a. (MoM) (JUL),0.3%,-,06:00
1799,7.5B,EUR,"Thursday, September 8, 2011",10.0B,d,Low,EUR German Current Account (euros) (JUL),11.5B,d,06:00
1800,10.4B,EUR,"Thursday, September 8, 2011",11.5B,d,Medium,EUR German Trade Balance (euros) (JUL),12.7B,-,06:00
1801,98,EUR,"Thursday, September 8, 2011",97,u,Low,EUR Bank of France Business Sentiment (AUG),98,-,06:30
1802,-6460M,EUR,"Thursday, September 8, 2011",-5900M,d,Low,EUR French Trade Balance (euros) (JUL),-5405M,u,06:45
1803,200B,GBP,"Thursday, September 8, 2011",200B,-,High,GBP BOE Asset Purchase Target (SEP),200B,-,11:00
1804,0.50%,GBP,"Thursday, September 8, 2011",0.50%,-,High,GBP Bank of England Rate Decision (SEP 8),0.50%,-,11:00
1805,1.50%,EUR,"Thursday, September 8, 2011",1.50%,-,High,EUR European Central Bank Rate Decision (SEP 8),1.50%,-,11:45
1806,6.3%,CAD,"Thursday, September 8, 2011",-1.5%,u,Low,CAD Building Permits (MoM) (JUL),2.8%,u,12:30
1807,0.1%,CAD,"Thursday, September 8, 2011",0.3%,d,Low,CAD New Housing Price Index (MoM) (JUL),0.3%,d,12:30
1808,2.3%,CAD,"Thursday, September 8, 2011",2.5%,d,Low,CAD New Housing Price Index (YoY) (JUL),2.1%,d,12:30
1809,-0.75B,CAD,"Thursday, September 8, 2011",-1.00B,u,Low,CAD International Merchandise Trade (Canadian dollar) (JUL),-1.37B,u,12:30
1810,-$44.8B,USD,"Thursday, September 8, 2011",-$51.0B,u,Medium,USD Trade Balance (JUL),-$51.6B,u,12:30
1811,414K,USD,"Thursday, September 8, 2011",405K,d,Low,USD Initial Jobless Claims (SEP 2),412K,u,12:30
1812,3717K,USD,"Thursday, September 8, 2011",3706K,u,Low,USD Continuing Claims (AUG 27),3747K,u,12:30
1813,,USD,"Thursday, September 8, 2011",-49.3,-,Low,USD Bloomberg Consumer Comfort (SEP 4),-49.1,-,13:45
1814,-3963K,USD,"Thursday, September 8, 2011",-2000K,d,Low,USD DOE U.S. Crude Oil Inventories (SEP 2),5281K,d,14:30
1815,-396K,USD,"Thursday, September 8, 2011",,u,Low,USD DOE Cushing OK Crude Inventory (SEP 2),-577K,d,14:30
1816,709K,USD,"Thursday, September 8, 2011",500K,u,Low,USD DOE U.S. Distillate Inventory (SEP 2),363K,d,14:30
1817,199K,USD,"Thursday, September 8, 2011",-1400K,u,Low,USD DOE U.S. Gasoline Inventories (SEP 2),-2795K,d,14:30
1818,-0.2%,USD,"Thursday, September 8, 2011",-1.0%,u,Low,USD DOE U.S. Refinery Utilization (SEP 2),-1.1%,d,14:30
1819,,USD,"Thursday, September 8, 2011",,-,Low,USD Fed's Bernanke Speaks to Economics Club in Minnesota,,-,17:00
1820,$11.965B,USD,"Thursday, September 8, 2011",$6.000B,u,Medium,USD Consumer Credit (JUL),$11.349B,u,19:00
1821,-0.7%,NZD,"Thursday, September 8, 2011",0.5%,d,Medium,NZD NZ Card Spending - Retail (MoM) (AUG),0.3%,d,22:45
1822,-0.5%,NZD,"Thursday, September 8, 2011",0.4%,d,Medium,NZD NZ Card Spending - Total (MoM) (AUG),0.2%,-,22:45
1823,-2.2%,JPY,"Thursday, September 8, 2011",-2.2%,-,Low,JPY Gross Domestic Product Deflator (YoY) (2Q F),-2.2%,-,23:50
1824,-1.5%,JPY,"Thursday, September 8, 2011",-1.6%,u,High,JPY Nominal Gross Domestic Product (QoQ) (2Q F),-1.4%,-,23:50
1825,-2.1%,JPY,"Thursday, September 8, 2011",-2.1%,-,Medium,JPY Gross Domestic Product Annualized (2Q F),-1.3%,-,23:50
1826,-0.5%,JPY,"Thursday, September 8, 2011",-0.5%,-,Medium,JPY Gross Domestic Product (QoQ) (2Q F),-0.3%,-,23:50
1827,2.7%,JPY,"Thursday, September 8, 2011",2.9%,d,Low,JPY Japan Money Stock M2+CD (YoY) (AUG),3.0%%,u,23:50
1828,2.2%,JPY,"Thursday, September 8, 2011",2.3%,d,Low,JPY Japan Money Stock M3 (YoY) (AUG),2.4%,u,23:50
1829,,JPY,"Wednesday, September 7, 2011",0.10%,-,High,JPY Bank of Japan Rate Decision (SEP 7),0.10%,-,
1830,1.2%,AUD,"Wednesday, September 7, 2011",1.0%,u,High,AUD Gross Domestic Product (QoQ) (2Q),-0.9%,u,01:30
1831,1.4%,AUD,"Wednesday, September 7, 2011",0.7%,u,High,AUD Gross Domestic Product (YoY) (2Q),1.0%,-,01:30
1832,109.0,JPY,"Wednesday, September 7, 2011",108.8,u,Low,JPY Coincident Index (JUL P) (JUL P),109.3,u,05:00
1833,106.0,JPY,"Wednesday, September 7, 2011",105.9,u,Medium,JPY Leading Index (JUL P) (JUL P),103.3,u,05:00
1834,A$43.8B,AUD,"Wednesday, September 7, 2011",,-,Low,AUD Foreign Reserves (Australian dollar) (AUG),A$40.7B,-,06:30
1835,-0.2%,GBP,"Wednesday, September 7, 2011",0.2%,d,Low,GBP Industrial Production (MoM) (JUL),0.0%,-,08:30
1836,-0.7%,GBP,"Wednesday, September 7, 2011",-0.4%,d,Medium,GBP Industrial Production (YoY) (JUL),-0.3%,-,08:30
1837,0.1%,GBP,"Wednesday, September 7, 2011",0.0%,u,Low,GBP Manufacturing Production (MoM) (JUL),-0.4%,-,08:30
1838,1.9%,GBP,"Wednesday, September 7, 2011",1.9%,-,Medium,GBP Manufacturing Production (YoY) (JUL),2.1%,-,08:30
1839,10.1%,EUR,"Wednesday, September 7, 2011",6.5%,u,Medium,EUR German Industrial Production n.s.a. and w.d.a. (YoY) (JUL),6.6%,d,10:00
1840,4.0%,EUR,"Wednesday, September 7, 2011",0.5%,u,Medium,EUR German Industrial Production s.a. (MoM) (JUL),-1.0%,u,10:00
1841,-4.9%,USD,"Wednesday, September 7, 2011",,-,Low,USD MBA Mortgage Applications (SEP 2),-9.6%,-,11:00
1842,1.00%,CAD,"Wednesday, September 7, 2011",1.00%,-,High,CAD Bank of Canada Rate Decision (SEP 7),1.00%,-,13:00
1843,57.6,CAD,"Wednesday, September 7, 2011",52.2,-,Medium,CAD Ivey Purchasing Managers Index (AUG),45.4,-,14:00
1844,0.2%,GBP,"Wednesday, September 7, 2011",,d,High,GBP NIESR Gross Domestic Product Estimate (AUG),0.6%,-,14:00
1845,,CAD,"Wednesday, September 7, 2011",52.3,-,Medium,CAD Ivey Purchasing Managers Index s.a. (AUG),46.8,-,14:00
1846,3228,USD,"Wednesday, September 7, 2011",3074,-,Low,USD JOLTs Job Openings (JUL),3109,-,14:00
1847,,USD,"Wednesday, September 7, 2011",,-,Low,USD Fed's Evans Speaks in London,,-,15:15
1848,,USD,"Wednesday, September 7, 2011",,-,Medium,USD Fed Releases Beige Book Economic Survey,,-,18:00
1849,,USD,"Wednesday, September 7, 2011",,-,Low,USD Fed's Williams Speaks to Seattle Rotary Club,,-,20:00
1850,,NZD,"Wednesday, September 7, 2011",,-,Low,NZD Value of All Buildings s.a. (2Q),-6.3,-,22:45
1851,,NZD,"Wednesday, September 7, 2011",,-,Medium,NZD Manufacturing Activity (2Q),2.9%,-,22:45
1852,,NZD,"Wednesday, September 7, 2011",,-,Low,NZD Manufacturing Activity Volume s.a. (QoQ) (2Q),1.9%,-,22:45
1853,-0.5%,JPY,"Wednesday, September 7, 2011",,u,Low,JPY Bank Lending Banks ex-Trust (AUG),-0.6%,-,23:50
1854,-0.5%,JPY,"Wednesday, September 7, 2011",,u,Low,JPY Bank Lending incl Trusts (YoY) (AUG),-0.6%,d,23:50
1855,¥990.2B,JPY,"Wednesday, September 7, 2011",¥1175.8B,-,Low,JPY Current Account Total (Yen) (JUL),¥526.9B,-,23:50
1856,,JPY,"Wednesday, September 7, 2011",¥990.8B,-,Low,JPY Adjusted Current Account Total (Yen) (JUL),¥922.8B,-,23:50
1857,-42.4%,JPY,"Wednesday, September 7, 2011",-32.5%,d,Low,JPY Current Account Balance (YoY) (JUL),-50.2%,-,23:50
1858,¥123.3B,JPY,"Wednesday, September 7, 2011",¥149.1B,d,Medium,JPY Trade Balance - BOP Basis (Yen) (JUL),¥131.5B,-,23:50
1859,-8.2%,JPY,"Wednesday, September 7, 2011",-4.2%,d,Medium,JPY Machine Orders (MoM) (JUL),7.7%,-,23:50
1860,4.0%,JPY,"Wednesday, September 7, 2011",8.3%,d,Medium,JPY Machine Orders (YoY) (JUL),17.9%,-,23:50
1861,-7419M,AUD,"Tuesday, September 6, 2011",-7100M,d,Medium,AUD Current Account Balance (Australian Dollar) (2Q),-11115M,d,01:30
1862,1.9%,AUD,"Tuesday, September 6, 2011",,-,Low,AUD Investment Lending (JUL),-4.2%,u,01:30
1863,-0.5%,AUD,"Tuesday, September 6, 2011",0.1%,d,Low,AUD Australia Net Exports of GDP (2Q),-2.4%,-,01:30
1864,1.4%,AUD,"Tuesday, September 6, 2011",,-,Low,AUD Owner-Occupied Home Loans (MoM) (JUL),0.2%,u,01:30
1865,1.0%,AUD,"Tuesday, September 6, 2011",1.5%,d,Medium,AUD Home Loans (JUL),0.6%,u,01:30
1866,4.75%,AUD,"Tuesday, September 6, 2011",4.75%,-,High,AUD Reserve Bank of Australia Rate Decision (SEP 6),4.75%,-,04:30
1867,253.4B,CHF,"Tuesday, September 6, 2011",,-,Low,CHF Foreign Currency Reserves (AUG),182.1B,-,07:00
1868,0.3%,CHF,"Tuesday, September 6, 2011",-0.2%,u,Medium,CHF Consumer Price Index (MoM) (AUG),-0.8%,-,07:15
1869,0.2%,CHF,"Tuesday, September 6, 2011",0.3%,d,Medium,CHF Consumer Price Index (YoY) (AUG),0.5%,-,07:15
1870,-0.6%,CHF,"Tuesday, September 6, 2011",,-,Medium,CHF CPI - EU Harmonised (MoM) (AUG),-0.8%,-,07:15
1871,-0.3%,CHF,"Tuesday, September 6, 2011",,-,Medium,CHF CPI - EU Harmonised (YoY) (AUG),0.3%,-,07:15
1872,7.3%,GBP,"Tuesday, September 6, 2011",,-,Low,GBP New Car Registrations (YoY) (AUG),-3.5%,-,08:00
1873,0.2%,EUR,"Tuesday, September 6, 2011",0.2%,-,High,EUR Euro-Zone Gross Domestic Product s.a. (QoQ) (2Q P),0.2%,-,09:00
1874,1.6%,EUR,"Tuesday, September 6, 2011",1.7%,d,High,EUR Euro-Zone Gross Domestic Product s.a. (YoY) (2Q P),1.7%,-,09:00
1875,-0.2%,EUR,"Tuesday, September 6, 2011",-0.1%,d,Medium,EUR Euro-Zone Household Consumption (QoQ) (2Q P),0.2%,d,09:00
1876,0.2%,EUR,"Tuesday, September 6, 2011",0.8%,d,Medium,EUR Euro-Zone Gross Fixed Capital (QoQ) (2Q P),1.8%,d,09:00
1877,-0.2%,EUR,"Tuesday, September 6, 2011",0.1%,d,Low,EUR Euro-Zone Government Expenditure (QoQ) (2Q P),0.5%,d,09:00
1878,8.7%,EUR,"Tuesday, September 6, 2011",9.8%,d,Medium,EUR German Factory Orders n.s.a. (YoY) (JUL),9.4%,d,10:00
1879,-2.8%,EUR,"Tuesday, September 6, 2011",-1.5%,d,Medium,EUR German Factory Orders s.a. (MoM) (JUL),1.8%,-,10:00
1880,53.3,USD,"Tuesday, September 6, 2011",51.0,-,Medium,USD ISM Non-Manufacturing Composite (AUG),52.7,-,14:00
1881,,USD,"Tuesday, September 6, 2011",,-,Low,USD Fed's Kocherlakota Speaks at University of Minnesota,,-,17:10
1882,2.7%,GBP,"Tuesday, September 6, 2011",,-,Low,GBP BRC Shop Price Index (YoY) (AUG),2.8%,-,23:01
1883,32.1,AUD,"Tuesday, September 6, 2011",,-,Medium,AUD AiG Performance of Construction Index (AUG),36.1,-,23:30
1884,$1218.5B,JPY,"Tuesday, September 6, 2011",,-,Low,JPY Official Reserve Assets (AUG),$1150.9B,-,23:50
1885,-0.1%,AUD,"Monday, September 5, 2011",,d,Low,AUD TD Securities Inflation (MoM) (AUG),0.3%,-,00:30
1886,2.9%,AUD,"Monday, September 5, 2011",,d,Medium,AUD TD Securities Inflation (YoY) (AUG),3.2%,-,00:30
1887,6.7%,AUD,"Monday, September 5, 2011",2.9%,u,Low,AUD Company Operating Profit (QoQ) (2Q),-2.2%,d,01:30
1888,2.5%,AUD,"Monday, September 5, 2011",0.3%,u,Low,AUD Inventories (2Q),0.7%,u,01:30
1889,-0.6%,AUD,"Monday, September 5, 2011",,-,Low,AUD ANZ Job Advertisements (MoM) (AUG),-0.6%,d,01:30
1890,50.6,CNY,"Monday, September 5, 2011",,d,Low,CNY China HSBC Services PMI (AUG),53.5,-,02:30
1891,48.4,EUR,"Monday, September 5, 2011",48.4,-,Low,EUR Italian Purchasing Manager Index Services (AUG),48.6,-,07:45
1892,56.8,EUR,"Monday, September 5, 2011",56.1,u,Low,EUR French Purchasing Manager Index Services (AUG F),56.1,-,07:50
1893,51.1,EUR,"Monday, September 5, 2011",50.4,u,Medium,EUR German Purchasing Manager Index Services (AUG F),50.4,-,07:55
1894,50.7,EUR,"Monday, September 5, 2011",50.9,d,Medium,EUR Euro-Zone Purchasing Manager Index Composite (AUG F),51.1,-,08:00
1895,51.5,EUR,"Monday, September 5, 2011",51.5,-,Medium,EUR Euro-Zone Purchasing Manager Index Services (AUG F),51.5,-,08:00
1896,51.1,GBP,"Monday, September 5, 2011",54.0,d,Medium,GBP Purchasing Manager Index Services (AUG),55.4,-,08:30
1897,-15.4,EUR,"Monday, September 5, 2011",-17.7,u,Medium,EUR Euro-Zone Sentix Investor Confidence (SEP),-13.5,-,08:30
1898,$2237M,GBP,"Monday, September 5, 2011",,-,Low,GBP Official Reserves (Changes) (AUG),$2082M,-,08:30
1899,0.2%,EUR,"Monday, September 5, 2011",0.0%,u,Medium,EUR Euro-Zone Retail Sales (MoM) (JUL),0.7%,d,09:00
1900,-0.2%,EUR,"Monday, September 5, 2011",-1.0%,u,High,EUR Euro-Zone Retail Sales (YoY) (JUL),-0.7%,d,09:00
1901,-0.6%,GBP,"Monday, September 5, 2011",0.0%,d,Low,GBP BRC Sales Like-For-Like (YoY) (AUG),0.6%,-,23:01
1902,-66,GBP,"Sunday, September 4, 2011",,d,Low,GBP Lloyds Employment Confidence (AUG),-53,-,23:01
1903,52.1,AUD,"Sunday, September 4, 2011",,d,Medium,AUD AiG Performance of Service Index (AUG),48.8,-,23:30
1904,52.6,GBP,"Friday, September 2, 2011",53.2,d,Low,GBP Purchasing Manager Index Construction (AUG),53.5,-,08:30
1905,0.5%,EUR,"Friday, September 2, 2011",0.5%,-,Medium,EUR Euro-Zone Producer Price Index (MoM) (JUL),0.0%,-,09:00
1906,6.1%,EUR,"Friday, September 2, 2011",6.1%,-,High,EUR Euro-Zone Producer Price Index (YoY) (JUL),5.9%,-,09:00
1907,0K,USD,"Friday, September 2, 2011",68K,d,High,USD Change in Non-farm Payrolls (AUG),85K,d,12:30
1908,17K,USD,"Friday, September 2, 2011",95K,d,Medium,USD Change in Private Payrolls (AUG),156K,u,12:30
1909,-3K,USD,"Friday, September 2, 2011",0K,d,Low,USD Change in Manufacturing Payrolls (AUG),36K,u,12:30
1910,9.1%,USD,"Friday, September 2, 2011",9.1%,-,High,USD Unemployment Rate (AUG),9.1%,-,12:30
1911,-0.1%,USD,"Friday, September 2, 2011",0.2%,d,Medium,USD Avg Hourly Earning (MoM) (AUG),0.5%,u,12:30
1912,1.9%,USD,"Friday, September 2, 2011",2.2%,d,Medium,USD Avg Hourly Earning (YoY) (AUG),2.3%,-,12:30
1913,34.2,USD,"Friday, September 2, 2011",34.3,d,Low,USD Avg Weekly Hours All Employees (AUG),34.3,-,12:30
1914,331,USD,"Friday, September 2, 2011",,-,Low,USD Change in Household Survey Employment (AUG),-38,-,12:30
